d_case_folding,d_digits_removal,d_breaking_hyphens,d_punctuation_mark_removal,d_tokenizing,d_stemming,d_stopword_removal,,label
tube-style free porn videos &amp; movies. free porn at gonzo xxx movies. 100% free: enjoy!,tube-style free porn videos &amp; movies. free porn at gonzo xxx movies. % free: enjoy!,tube style free porn videos &amp; movies. free porn at gonzo xxx movies. % free: enjoy!,tube style free porn videos amp; movies free porn at gonzo xxx movies free enjoy,"['tube', 'style', 'free', 'porn', 'videos', 'amp', ';', 'movies', 'free', 'porn', 'at', 'gonzo', 'xxx', 'movies', 'free', 'enjoy']","['tube', 'style', 'free', 'porn', 'video', 'amp', '', 'movie', 'free', 'porn', 'at', 'gonzo', 'xxx', 'movie', 'free', 'enjoy']","['tube', 'style', 'free', 'porn', 'video', 'amp', '', 'movie', 'free', 'porn', 'gonzo', 'xxx', 'movie', 'free', 'enjoy']",,berbahaya
"fleshbot: the hottest and longest running porn blog for pornstar interviews, sexy photos, hardcore videos and the newest adult dvds.","fleshbot: the hottest and longest running porn blog for pornstar interviews, sexy photos, hardcore videos and the newest adult dvds.","fleshbot: the hottest and longest running porn blog for pornstar interviews, sexy photos, hardcore videos and the newest adult dvds.",fleshbot the hottest and longest running porn blog for pornstar interviews sexy photos hardcore videos and the newest adult dvds,"['fleshbot', 'the', 'hottest', 'and', 'longest', 'running', 'porn', 'blog', 'for', 'pornstar', 'interviews', 'sexy', 'photos', 'hardcore', 'videos', 'and', 'the', 'newest', 'adult', 'dvds']","['fleshbot', 'the', 'hottest', 'and', 'long', 'run', 'porn', 'blog', 'for', 'pornstar', 'interview', 'sexy', 'photo', 'hardcore', 'video', 'and', 'the', 'new', 'adult', 'dvd']","['fleshbot', 'hottest', 'long', 'run', 'porn', 'blog', 'pornstar', 'interview', 'sexy', 'photo', 'hardcore', 'video', 'new', 'adult', 'dvd']",,berbahaya
"nuvid is the phenomenon of modern pornography. with almost 10 years history of publishing the hottest porn videos online, nuvid.com still rocks hard!","nuvid is the phenomenon of modern pornography. with almost  years history of publishing the hottest porn videos online, nuvid.com still rocks hard!","nuvid is the phenomenon of modern pornography. with almost  years history of publishing the hottest porn videos online, nuvid.com still rocks hard!",nuvid is the phenomenon of modern pornography with almost years history of publishing the hottest porn videos online nuvidcom still rocks hard,"['nuvid', 'is', 'the', 'phenomenon', 'of', 'modern', 'pornography', 'with', 'almost', 'years', 'history', 'of', 'publishing', 'the', 'hottest', 'porn', 'videos', 'online', 'nuvidcom', 'still', 'rocks', 'hard']","['nuvid', 'be', 'the', 'phenomenon', 'of', 'modern', 'pornography', 'with', 'almost', 'year', 'history', 'of', 'publishing', 'the', 'hottest', 'porn', 'video', 'online', 'nuvidcom', 'still', 'rock', 'hard']","['nuvid', 'phenomenon', 'modern', 'pornography', 'almost', 'year', 'history', 'publishing', 'hottest', 'porn', 'video', 'online', 'nuvidcom', 'still', 'rock', 'hard']",,berbahaya
"badjojo is the #1 free porn search engine, with millions of free videos. we have amateur, teen or milf videos from the best porn sites.","badjojo is the # free porn search engine, with millions of free videos. we have amateur, teen or milf videos from the best porn sites.","badjojo is the # free porn search engine, with millions of free videos. we have amateur, teen or milf videos from the best porn sites.",badjojo is the free porn search engine with millions of free videos we have amateur teen or milf videos from the best porn sites,"['badjojo', 'is', 'the', 'free', 'porn', 'search', 'engine', 'with', 'millions', 'of', 'free', 'videos', 'we', 'have', 'amateur', 'teen', 'or', 'milf', 'videos', 'from', 'the', 'best', 'porn', 'sites']","['badjojo', 'be', 'the', 'free', 'porn', 'search', 'engine', 'with', 'million', 'of', 'free', 'video', 'we', 'have', 'amateur', 'teen', 'or', 'milf', 'video', 'from', 'the', 'best', 'porn', 'site']","['badjojo', 'free', 'porn', 'search', 'engine', 'million', 'free', 'video', 'amateur', 'teen', 'milf', 'video', 'best', 'porn', 'site']",,berbahaya
"anime, manga and games, observed from japan","anime, manga and games, observed from japan","anime, manga and games, observed from japan",anime manga and games observed from japan,"['anime', 'manga', 'and', 'games', 'observed', 'from', 'japan']","['anime', 'manga', 'and', 'game', 'observe', 'from', 'japan']","['anime', 'manga', 'game', 'observe', 'japan']",,berbahaya
"the best free live webcam shows of girls, mature women, couples, amateurs and pornstars. watch cams of naked models and spy on them. free to watch and free to chat.","the best free live webcam shows of girls, mature women, couples, amateurs and pornstars. watch cams of naked models and spy on them. free to watch and free to chat.","the best free live webcam shows of girls, mature women, couples, amateurs and pornstars. watch cams of naked models and spy on them. free to watch and free to chat.",the best free live webcam shows of girls mature women couples amateurs and pornstars watch cams of naked models and spy on them free to watch and free to chat,"['the', 'best', 'free', 'live', 'webcam', 'shows', 'of', 'girls', 'mature', 'women', 'couples', 'amateurs', 'and', 'pornstars', 'watch', 'cams', 'of', 'naked', 'models', 'and', 'spy', 'on', 'them', 'free', 'to', 'watch', 'and', 'free', 'to', 'chat']","['the', 'best', 'free', 'live', 'webcam', 'show', 'of', 'girl', 'mature', 'woman', 'couple', 'amateur', 'and', 'pornstars', 'watch', 'cam', 'of', 'naked', 'model', 'and', 'spy', 'on', 'them', 'free', 'to', 'watch', 'and', 'free', 'to', 'chat']","['best', 'free', 'live', 'webcam', 'show', 'girl', 'mature', 'woman', 'couple', 'amateur', 'pornstars', 'watch', 'cam', 'naked', 'model', 'spy', 'free', 'watch', 'free', 'chat']",,berbahaya
cliphunter delivers free porn movies with a fast porn tube experience.,cliphunter delivers free porn movies with a fast porn tube experience.,cliphunter delivers free porn movies with a fast porn tube experience.,cliphunter delivers free porn movies with a fast porn tube experience,"['cliphunter', 'delivers', 'free', 'porn', 'movies', 'with', 'a', 'fast', 'porn', 'tube', 'experience']","['cliphunter', 'delivers', 'free', 'porn', 'movie', 'with', 'a', 'fast', 'porn', 'tube', 'experience']","['cliphunter', 'delivers', 'free', 'porn', 'movie', 'fast', 'porn', 'tube', 'experience']",,berbahaya
"watch full hd porn videos for free. we have over 3,478,865 full length hardcore hd sex movies in 720p, 1080p and 4k that you can watch online or download.","watch full hd porn videos for free. we have over ,, full length hardcore hd sex movies in p, p and k that you can watch online or download.","watch full hd porn videos for free. we have over ,, full length hardcore hd sex movies in p, p and k that you can watch online or download.",watch full hd porn videos for free we have over full length hardcore hd sex movies in p p and k that you can watch online or download,"['watch', 'full', 'hd', 'porn', 'videos', 'for', 'free', 'we', 'have', 'over', 'full', 'length', 'hardcore', 'hd', 'sex', 'movies', 'in', 'p', 'p', 'and', 'k', 'that', 'you', 'can', 'watch', 'online', 'or', 'download']","['watch', 'full', 'hd', 'porn', 'video', 'for', 'free', 'we', 'have', 'over', 'full', 'length', 'hardcore', 'hd', 'sex', 'movie', 'in', 'p', 'p', 'and', 'k', 'that', 'you', 'can', 'watch', 'online', 'or', 'download']","['watch', 'full', 'hd', 'porn', 'video', 'free', 'full', 'length', 'hardcore', 'hd', 'sex', 'movie', 'p', 'p', 'k', 'watch', 'online', 'download']",,berbahaya
watch live sex cam on the adult cam chatroulette : free sex chat with hot cam girls! a live sex cam platform where nude girls put on free cam shows.,watch live sex cam on the adult cam chatroulette : free sex chat with hot cam girls! a live sex cam platform where nude girls put on free cam shows.,watch live sex cam on the adult cam chatroulette : free sex chat with hot cam girls! a live sex cam platform where nude girls put on free cam shows.,watch live sex cam on the adult cam chatroulette free sex chat with hot cam girls a live sex cam platform where nude girls put on free cam shows,"['watch', 'live', 'sex', 'cam', 'on', 'the', 'adult', 'cam', 'chatroulette', 'free', 'sex', 'chat', 'with', 'hot', 'cam', 'girls', 'a', 'live', 'sex', 'cam', 'platform', 'where', 'nude', 'girls', 'put', 'on', 'free', 'cam', 'shows']","['watch', 'live', 'sex', 'cam', 'on', 'the', 'adult', 'cam', 'chatroulette', 'free', 'sex', 'chat', 'with', 'hot', 'cam', 'girl', 'a', 'live', 'sex', 'cam', 'platform', 'where', 'nude', 'girl', 'put', 'on', 'free', 'cam', 'show']","['watch', 'live', 'sex', 'cam', 'adult', 'cam', 'chatroulette', 'free', 'sex', 'chat', 'hot', 'cam', 'girl', 'live', 'sex', 'cam', 'platform', 'nude', 'girl', 'put', 'free', 'cam', 'show']",,berbahaya
gaymaletube has the hottest gay porn. we cater to all your needs and make you rock hard in seconds. enter & get off!,gaymaletube has the hottest gay porn. we cater to all your needs and make you rock hard in seconds. enter & get off!,gaymaletube has the hottest gay porn. we cater to all your needs and make you rock hard in seconds. enter & get off!,gaymaletube has the hottest gay porn we cater to all your needs and make you rock hard in seconds enter get off,"['gaymaletube', 'has', 'the', 'hottest', 'gay', 'porn', 'we', 'cater', 'to', 'all', 'your', 'needs', 'and', 'make', 'you', 'rock', 'hard', 'in', 'seconds', 'enter', 'get', 'off']","['gaymaletube', 'have', 'the', 'hottest', 'gay', 'porn', 'we', 'cater', 'to', 'all', 'your', 'need', 'and', 'make', 'you', 'rock', 'hard', 'in', 'second', 'enter', 'get', 'off']","['gaymaletube', 'hottest', 'gay', 'porn', 'cater', 'need', 'make', 'rock', 'hard', 'second', 'enter', 'get']",,berbahaya
"millions of free hentai and anime videos, images, wallpapers, and more! no account needed, updated constantly!","millions of free hentai and anime videos, images, wallpapers, and more! no account needed, updated constantly!","millions of free hentai and anime videos, images, wallpapers, and more! no account needed, updated constantly!",millions of free hentai and anime videos images wallpapers and more no account needed updated constantly,"['millions', 'of', 'free', 'hentai', 'and', 'anime', 'videos', 'images', 'wallpapers', 'and', 'more', 'no', 'account', 'needed', 'updated', 'constantly']","['million', 'of', 'free', 'hentai', 'and', 'anime', 'video', 'image', 'wallpaper', 'and', 'more', 'no', 'account', 'need', 'update', 'constantly']","['million', 'free', 'hentai', 'anime', 'video', 'image', 'wallpaper', 'account', 'need', 'update', 'constantly']",,berbahaya
free porn movies – elephanttube. enter and enjoy our large collection of porn. we have millions of free porn movies so visit us now!,free porn movies – elephanttube. enter and enjoy our large collection of porn. we have millions of free porn movies so visit us now!,free porn movies – elephanttube. enter and enjoy our large collection of porn. we have millions of free porn movies so visit us now!,free porn movies – elephanttube enter and enjoy our large collection of porn we have millions of free porn movies so visit us now,"['free', 'porn', 'movies', '–', 'elephanttube', 'enter', 'and', 'enjoy', 'our', 'large', 'collection', 'of', 'porn', 'we', 'have', 'millions', 'of', 'free', 'porn', 'movies', 'so', 'visit', 'us', 'now']","['free', 'porn', 'movie', '', 'elephanttube', 'enter', 'and', 'enjoy', 'our', 'large', 'collection', 'of', 'porn', 'we', 'have', 'million', 'of', 'free', 'porn', 'movie', 'so', 'visit', 'u', 'now']","['free', 'porn', 'movie', '', 'elephanttube', 'enter', 'enjoy', 'large', 'collection', 'porn', 'million', 'free', 'porn', 'movie', 'visit', 'u']",,berbahaya
home of hd reality porn featuring the nicest tits and ass online! the hottest curvy girls in real amateur sex stories are only on realitykings.com,home of hd reality porn featuring the nicest tits and ass online! the hottest curvy girls in real amateur sex stories are only on realitykings.com,home of hd reality porn featuring the nicest tits and ass online! the hottest curvy girls in real amateur sex stories are only on realitykings.com,home of hd reality porn featuring the nicest tits and ass online the hottest curvy girls in real amateur sex stories are only on realitykingscom,"['home', 'of', 'hd', 'reality', 'porn', 'featuring', 'the', 'nicest', 'tits', 'and', 'ass', 'online', 'the', 'hottest', 'curvy', 'girls', 'in', 'real', 'amateur', 'sex', 'stories', 'are', 'only', 'on', 'realitykingscom']","['home', 'of', 'hd', 'reality', 'porn', 'feature', 'the', 'nice', 'tit', 'and', 'as', 'online', 'the', 'hottest', 'curvy', 'girl', 'in', 'real', 'amateur', 'sex', 'story', 'be', 'only', 'on', 'realitykingscom']","['home', 'hd', 'reality', 'porn', 'feature', 'nice', 'tit', 'online', 'hottest', 'curvy', 'girl', 'real', 'amateur', 'sex', 'story', 'realitykingscom']",,berbahaya
nude girls free pictures and videos,nude girls free pictures and videos,nude girls free pictures and videos,nude girls free pictures and videos,"['nude', 'girls', 'free', 'pictures', 'and', 'videos']","['nude', 'girl', 'free', 'picture', 'and', 'video']","['nude', 'girl', 'free', 'picture', 'video']",,berbahaya
"boobpedia is a user-editable encyclopedia of women with big tits. look up your favourite busty nude models and porn stars, or discover new favourites.","boobpedia is a user-editable encyclopedia of women with big tits. look up your favourite busty nude models and porn stars, or discover new favourites.","boobpedia is a user editable encyclopedia of women with big tits. look up your favourite busty nude models and porn stars, or discover new favourites.",boobpedia is a user editable encyclopedia of women with big tits look up your favourite busty nude models and porn stars or discover new favourites,"['boobpedia', 'is', 'a', 'user', 'editable', 'encyclopedia', 'of', 'women', 'with', 'big', 'tits', 'look', 'up', 'your', 'favourite', 'busty', 'nude', 'models', 'and', 'porn', 'stars', 'or', 'discover', 'new', 'favourites']","['boobpedia', 'be', 'a', 'user', 'editable', 'encyclopedia', 'of', 'woman', 'with', 'big', 'tit', 'look', 'up', 'your', 'favourite', 'busty', 'nude', 'model', 'and', 'porn', 'star', 'or', 'discover', 'new', 'favourite']","['boobpedia', 'user', 'editable', 'encyclopedia', 'woman', 'big', 'tit', 'look', 'favourite', 'busty', 'nude', 'model', 'porn', 'star', 'discover', 'new', 'favourite']",,berbahaya
"browse millions of hot free porn pics, sex gifs, hot nude photo galleries, amateur xxx photos only on imagefap, the world's largest porn pic sharing community.","browse millions of hot free porn pics, sex gifs, hot nude photo galleries, amateur xxx photos only on imagefap, the world's largest porn pic sharing community.","browse millions of hot free porn pics, sex gifs, hot nude photo galleries, amateur xxx photos only on imagefap, the world's largest porn pic sharing community.",browse millions of hot free porn pics sex gifs hot nude photo galleries amateur xxx photos only on imagefap the world's largest porn pic sharing community,"['browse', 'millions', 'of', 'hot', 'free', 'porn', 'pics', 'sex', 'gifs', 'hot', 'nude', 'photo', 'galleries', 'amateur', 'xxx', 'photos', 'only', 'on', 'imagefap', 'the', 'world', ""'s"", 'largest', 'porn', 'pic', 'sharing', 'community']","['browse', 'million', 'of', 'hot', 'free', 'porn', 'pic', 'sex', 'gifs', 'hot', 'nude', 'photo', 'gallery', 'amateur', 'xxx', 'photo', 'only', 'on', 'imagefap', 'the', 'world', 's', 'large', 'porn', 'pic', 'share', 'community']","['browse', 'million', 'hot', 'free', 'porn', 'pic', 'sex', 'gifs', 'hot', 'nude', 'photo', 'gallery', 'amateur', 'xxx', 'photo', 'imagefap', 'world', 'large', 'porn', 'pic', 'share', 'community']",,berbahaya
"vintage erotica forums - #1 vintage & classic erotica forum on the web, over 400000 members!","vintage erotica forums - # vintage & classic erotica forum on the web, over  members!","vintage erotica forums   # vintage & classic erotica forum on the web, over  members!",vintage erotica forums vintage classic erotica forum on the web over members,"['vintage', 'erotica', 'forums', 'vintage', 'classic', 'erotica', 'forum', 'on', 'the', 'web', 'over', 'members']","['vintage', 'erotica', 'forum', 'vintage', 'classic', 'erotica', 'forum', 'on', 'the', 'web', 'over', 'member']","['vintage', 'erotica', 'forum', 'vintage', 'classic', 'erotica', 'forum', 'web', 'member']",,berbahaya
"hottystop is a quality softcore website with hot teens, babes, hotties, and much more sexy content.","hottystop is a quality softcore website with hot teens, babes, hotties, and much more sexy content.","hottystop is a quality softcore website with hot teens, babes, hotties, and much more sexy content.",hottystop is a quality softcore website with hot teens babes hotties and much more sexy content,"['hottystop', 'is', 'a', 'quality', 'softcore', 'website', 'with', 'hot', 'teens', 'babes', 'hotties', 'and', 'much', 'more', 'sexy', 'content']","['hottystop', 'be', 'a', 'quality', 'softcore', 'website', 'with', 'hot', 'teen', 'babe', 'hotties', 'and', 'much', 'more', 'sexy', 'content']","['hottystop', 'quality', 'softcore', 'website', 'hot', 'teen', 'babe', 'hotties', 'much', 'sexy', 'content']",,berbahaya
"mofos brings you the best amateur content in the world, with free videos of the most beautiful pornstars, hardcore action in stunning 4k. enjoy thousands of videos to choose from @ mofos","mofos brings you the best amateur content in the world, with free videos of the most beautiful pornstars, hardcore action in stunning k. enjoy thousands of videos to choose from @ mofos","mofos brings you the best amateur content in the world, with free videos of the most beautiful pornstars, hardcore action in stunning k. enjoy thousands of videos to choose from @ mofos",mofos brings you the best amateur content in the world with free videos of the most beautiful pornstars hardcore action in stunning k enjoy thousands of videos to choose from mofos,"['mofos', 'brings', 'you', 'the', 'best', 'amateur', 'content', 'in', 'the', 'world', 'with', 'free', 'videos', 'of', 'the', 'most', 'beautiful', 'pornstars', 'hardcore', 'action', 'in', 'stunning', 'k', 'enjoy', 'thousands', 'of', 'videos', 'to', 'choose', 'from', 'mofos']","['mofos', 'brings', 'you', 'the', 'best', 'amateur', 'content', 'in', 'the', 'world', 'with', 'free', 'video', 'of', 'the', 'most', 'beautiful', 'pornstars', 'hardcore', 'action', 'in', 'stun', 'k', 'enjoy', 'thousand', 'of', 'video', 'to', 'choose', 'from', 'mofos']","['mofos', 'brings', 'best', 'amateur', 'content', 'world', 'free', 'video', 'beautiful', 'pornstars', 'hardcore', 'action', 'stun', 'k', 'enjoy', 'thousand', 'video', 'choose', 'mofos']",,berbahaya
"free teen porn videos of hardcore hd sex with petite schoolgirls, cheerleaders, college girls, babysitters, and innocent virgins. all models are legal and 18+.","free teen porn videos of hardcore hd sex with petite schoolgirls, cheerleaders, college girls, babysitters, and innocent virgins. all models are legal and +.","free teen porn videos of hardcore hd sex with petite schoolgirls, cheerleaders, college girls, babysitters, and innocent virgins. all models are legal and +.",free teen porn videos of hardcore hd sex with petite schoolgirls cheerleaders college girls babysitters and innocent virgins all models are legal and,"['free', 'teen', 'porn', 'videos', 'of', 'hardcore', 'hd', 'sex', 'with', 'petite', 'schoolgirls', 'cheerleaders', 'college', 'girls', 'babysitters', 'and', 'innocent', 'virgins', 'all', 'models', 'are', 'legal', 'and']","['free', 'teen', 'porn', 'video', 'of', 'hardcore', 'hd', 'sex', 'with', 'petite', 'schoolgirl', 'cheerleader', 'college', 'girl', 'babysitter', 'and', 'innocent', 'virgin', 'all', 'model', 'be', 'legal', 'and']","['free', 'teen', 'porn', 'video', 'hardcore', 'hd', 'sex', 'petite', 'schoolgirl', 'cheerleader', 'college', 'girl', 'babysitter', 'innocent', 'virgin', 'model', 'legal']",,berbahaya
free porn sex photos & nude pussy pics. pichunter has the largest collection of free porn and is trusted since 2001.,free porn sex photos & nude pussy pics. pichunter has the largest collection of free porn and is trusted since .,free porn sex photos & nude pussy pics. pichunter has the largest collection of free porn and is trusted since .,free porn sex photos nude pussy pics pichunter has the largest collection of free porn and is trusted since,"['free', 'porn', 'sex', 'photos', 'nude', 'pussy', 'pics', 'pichunter', 'has', 'the', 'largest', 'collection', 'of', 'free', 'porn', 'and', 'is', 'trusted', 'since']","['free', 'porn', 'sex', 'photo', 'nude', 'pussy', 'pic', 'pichunter', 'have', 'the', 'large', 'collection', 'of', 'free', 'porn', 'and', 'be', 'trust', 'since']","['free', 'porn', 'sex', 'photo', 'nude', 'pussy', 'pic', 'pichunter', 'large', 'collection', 'free', 'porn', 'trust', 'since']",,berbahaya
animal sex videos horse sex dog porn with human beastiality porn videos bestiality zoo tube woman with dog animal porn horse cum on girl,animal sex videos horse sex dog porn with human beastiality porn videos bestiality zoo tube woman with dog animal porn horse cum on girl,animal sex videos horse sex dog porn with human beastiality porn videos bestiality zoo tube woman with dog animal porn horse cum on girl,animal sex videos horse sex dog porn with human beastiality porn videos bestiality zoo tube woman with dog animal porn horse cum on girl,"['animal', 'sex', 'videos', 'horse', 'sex', 'dog', 'porn', 'with', 'human', 'beastiality', 'porn', 'videos', 'bestiality', 'zoo', 'tube', 'woman', 'with', 'dog', 'animal', 'porn', 'horse', 'cum', 'on', 'girl']","['animal', 'sex', 'video', 'horse', 'sex', 'dog', 'porn', 'with', 'human', 'beastiality', 'porn', 'video', 'bestiality', 'zoo', 'tube', 'woman', 'with', 'dog', 'animal', 'porn', 'horse', 'cum', 'on', 'girl']","['animal', 'sex', 'video', 'horse', 'sex', 'dog', 'porn', 'human', 'beastiality', 'porn', 'video', 'bestiality', 'zoo', 'tube', 'woman', 'dog', 'animal', 'porn', 'horse', 'cum', 'girl']",,berbahaya
free porn and xxx sex videos on freeporn.com,free porn and xxx sex videos on freeporn.com,free porn and xxx sex videos on freeporn.com,free porn and xxx sex videos on freeporncom,"['free', 'porn', 'and', 'xxx', 'sex', 'videos', 'on', 'freeporncom']","['free', 'porn', 'and', 'xxx', 'sex', 'video', 'on', 'freeporncom']","['free', 'porn', 'xxx', 'sex', 'video', 'freeporncom']",,berbahaya
"wet pussy games offers the highest quality hentai games, porn games, sex games, and all sorts of crazy hentai","wet pussy games offers the highest quality hentai games, porn games, sex games, and all sorts of crazy hentai","wet pussy games offers the highest quality hentai games, porn games, sex games, and all sorts of crazy hentai",wet pussy games offers the highest quality hentai games porn games sex games and all sorts of crazy hentai,"['wet', 'pussy', 'games', 'offers', 'the', 'highest', 'quality', 'hentai', 'games', 'porn', 'games', 'sex', 'games', 'and', 'all', 'sorts', 'of', 'crazy', 'hentai']","['wet', 'pussy', 'game', 'offer', 'the', 'high', 'quality', 'hentai', 'game', 'porn', 'game', 'sex', 'game', 'and', 'all', 'sort', 'of', 'crazy', 'hentai']","['wet', 'pussy', 'game', 'offer', 'high', 'quality', 'hentai', 'game', 'porn', 'game', 'sex', 'game', 'sort', 'crazy', 'hentai']",,berbahaya
pornerbros has free sex videos and porn videos. watch and download our free porn videos in hd with new videos every hour,pornerbros has free sex videos and porn videos. watch and download our free porn videos in hd with new videos every hour,pornerbros has free sex videos and porn videos. watch and download our free porn videos in hd with new videos every hour,pornerbros has free sex videos and porn videos watch and download our free porn videos in hd with new videos every hour,"['pornerbros', 'has', 'free', 'sex', 'videos', 'and', 'porn', 'videos', 'watch', 'and', 'download', 'our', 'free', 'porn', 'videos', 'in', 'hd', 'with', 'new', 'videos', 'every', 'hour']","['pornerbros', 'have', 'free', 'sex', 'video', 'and', 'porn', 'video', 'watch', 'and', 'download', 'our', 'free', 'porn', 'video', 'in', 'hd', 'with', 'new', 'video', 'every', 'hour']","['pornerbros', 'free', 'sex', 'video', 'porn', 'video', 'watch', 'download', 'free', 'porn', 'video', 'hd', 'new', 'video', 'every', 'hour']",,berbahaya
nude art photography and video of the world's most beautiful female models,nude art photography and video of the world's most beautiful female models,nude art photography and video of the world's most beautiful female models,nude art photography and video of the world's most beautiful female models,"['nude', 'art', 'photography', 'and', 'video', 'of', 'the', 'world', ""'s"", 'most', 'beautiful', 'female', 'models']","['nude', 'art', 'photography', 'and', 'video', 'of', 'the', 'world', 's', 'most', 'beautiful', 'female', 'model']","['nude', 'art', 'photography', 'video', 'world', 'beautiful', 'female', 'model']",,berbahaya
"free gay pictures, videos, profiles, webcam and a friendly community of hot men","free gay pictures, videos, profiles, webcam and a friendly community of hot men","free gay pictures, videos, profiles, webcam and a friendly community of hot men",free gay pictures videos profiles webcam and a friendly community of hot men,"['free', 'gay', 'pictures', 'videos', 'profiles', 'webcam', 'and', 'a', 'friendly', 'community', 'of', 'hot', 'men']","['free', 'gay', 'picture', 'video', 'profile', 'webcam', 'and', 'a', 'friendly', 'community', 'of', 'hot', 'men']","['free', 'gay', 'picture', 'video', 'profile', 'webcam', 'friendly', 'community', 'hot', 'men']",,berbahaya
