d_case_folding,d_digits_removal,d_breaking_hyphens,d_punctuation_mark_removal,d_tokenizing,d_stemming,d_stopword_removal,,label
android tablets .net covers the full range of android tablet devices and other android based pc's.,android tablets .net covers the full range of android tablet devices and other android based pc's.,android tablets .net covers the full range of android tablet devices and other android based pc's.,android tablets net covers the full range of android tablet devices and other android based pc's,"['android', 'tablets', 'net', 'covers', 'the', 'full', 'range', 'of', 'android', 'tablet', 'devices', 'and', 'other', 'android', 'based', 'pc', ""'s""]","['android', 'tablet', 'net', 'cover', 'the', 'full', 'range', 'of', 'android', 'tablet', 'device', 'and', 'other', 'android', 'base', 'pc', 's']","['android', 'tablet', 'net', 'cover', 'full', 'range', 'android', 'tablet', 'device', 'android', 'base', 'pc']",,aman
"autoblog brings you car news; expert reviews of cars, trucks, crossovers and suvs; and pictures and video. research and compare vehicles, find local dealers, calculate loan payments, find your car's book value and get a service estimate at autoblog.com.","autoblog brings you car news; expert reviews of cars, trucks, crossovers and suvs; and pictures and video. research and compare vehicles, find local dealers, calculate loan payments, find your car's book value and get a service estimate at autoblog.com.","autoblog brings you car news; expert reviews of cars, trucks, crossovers and suvs; and pictures and video. research and compare vehicles, find local dealers, calculate loan payments, find your car's book value and get a service estimate at autoblog.com.",autoblog brings you car news; expert reviews of cars trucks crossovers and suvs; and pictures and video research and compare vehicles find local dealers calculate loan payments find your car's book value and get a service estimate at autoblogcom,"['autoblog', 'brings', 'you', 'car', 'news', ';', 'expert', 'reviews', 'of', 'cars', 'trucks', 'crossovers', 'and', 'suvs', ';', 'and', 'pictures', 'and', 'video', 'research', 'and', 'compare', 'vehicles', 'find', 'local', 'dealers', 'calculate', 'loan', 'payments', 'find', 'your', 'car', ""'s"", 'book', 'value', 'and', 'get', 'a', 'service', 'estimate', 'at', 'autoblogcom']","['autoblog', 'brings', 'you', 'car', 'news', '', 'expert', 'review', 'of', 'car', 'truck', 'crossover', 'and', 'suv', '', 'and', 'picture', 'and', 'video', 'research', 'and', 'compare', 'vehicle', 'find', 'local', 'dealer', 'calculate', 'loan', 'payment', 'find', 'your', 'car', 's', 'book', 'value', 'and', 'get', 'a', 'service', 'estimate', 'at', 'autoblogcom']","['autoblog', 'brings', 'car', 'news', '', 'expert', 'review', 'car', 'truck', 'crossover', 'suv', '', 'picture', 'video', 'research', 'compare', 'vehicle', 'find', 'local', 'dealer', 'calculate', 'loan', 'payment', 'find', 'car', 'book', 'value', 'get', 'service', 'estimate', 'autoblogcom']",,aman
"trust motortrend for the best car reviews, news, car rankings, and much more. with more than 70 years of experience, we're your home for everything automotive.","trust motortrend for the best car reviews, news, car rankings, and much more. with more than  years of experience, we're your home for everything automotive.","trust motortrend for the best car reviews, news, car rankings, and much more. with more than  years of experience, we're your home for everything automotive.",trust motortrend for the best car reviews news car rankings and much more with more than years of experience we're your home for everything automotive,"['trust', 'motortrend', 'for', 'the', 'best', 'car', 'reviews', 'news', 'car', 'rankings', 'and', 'much', 'more', 'with', 'more', 'than', 'years', 'of', 'experience', 'we', ""'re"", 'your', 'home', 'for', 'everything', 'automotive']","['trust', 'motortrend', 'for', 'the', 'best', 'car', 'review', 'news', 'car', 'ranking', 'and', 'much', 'more', 'with', 'more', 'than', 'year', 'of', 'experience', 'we', 're', 'your', 'home', 'for', 'everything', 'automotive']","['trust', 'motortrend', 'best', 'car', 'review', 'news', 'car', 'ranking', 'much', 'year', 'experience', 'home', 'everything', 'automotive']",,aman
the no. 1 home entertainment tech community & resource,the no.  home entertainment tech community & resource,the no.  home entertainment tech community & resource,the no home entertainment tech community resource,"['the', 'no', 'home', 'entertainment', 'tech', 'community', 'resource']","['the', 'no', 'home', 'entertainment', 'tech', 'community', 'resource']","['home', 'entertainment', 'tech', 'community', 'resource']",,aman
"ijailbreak is an online resource for jailbreak and unlock iphone, ipad, ipod touch, apple tv and ios news. ijailbreak also covers android, microsoft, google, playstation and provides guides and tutorials.","ijailbreak is an online resource for jailbreak and unlock iphone, ipad, ipod touch, apple tv and ios news. ijailbreak also covers android, microsoft, google, playstation and provides guides and tutorials.","ijailbreak is an online resource for jailbreak and unlock iphone, ipad, ipod touch, apple tv and ios news. ijailbreak also covers android, microsoft, google, playstation and provides guides and tutorials.",ijailbreak is an online resource for jailbreak and unlock iphone ipad ipod touch apple tv and ios news ijailbreak also covers android microsoft google playstation and provides guides and tutorials,"['ijailbreak', 'is', 'an', 'online', 'resource', 'for', 'jailbreak', 'and', 'unlock', 'iphone', 'ipad', 'ipod', 'touch', 'apple', 'tv', 'and', 'ios', 'news', 'ijailbreak', 'also', 'covers', 'android', 'microsoft', 'google', 'playstation', 'and', 'provides', 'guides', 'and', 'tutorials']","['ijailbreak', 'be', 'an', 'online', 'resource', 'for', 'jailbreak', 'and', 'unlock', 'iphone', 'ipad', 'ipod', 'touch', 'apple', 'tv', 'and', 'io', 'news', 'ijailbreak', 'also', 'cover', 'android', 'microsoft', 'google', 'playstation', 'and', 'provide', 'guide', 'and', 'tutorial']","['ijailbreak', 'online', 'resource', 'jailbreak', 'unlock', 'iphone', 'ipad', 'ipod', 'touch', 'apple', 'tv', 'io', 'news', 'ijailbreak', 'also', 'cover', 'android', 'microsoft', 'google', 'playstation', 'provide', 'guide', 'tutorial']",,aman
"the world's first android news source, phandroid.com covers android news, reviews, and tips to help you get the most out of your smartphone or tablet.","the world's first android news source, phandroid.com covers android news, reviews, and tips to help you get the most out of your smartphone or tablet.","the world's first android news source, phandroid.com covers android news, reviews, and tips to help you get the most out of your smartphone or tablet.",the world's first android news source phandroidcom covers android news reviews and tips to help you get the most out of your smartphone or tablet,"['the', 'world', ""'s"", 'first', 'android', 'news', 'source', 'phandroidcom', 'covers', 'android', 'news', 'reviews', 'and', 'tips', 'to', 'help', 'you', 'get', 'the', 'most', 'out', 'of', 'your', 'smartphone', 'or', 'tablet']","['the', 'world', 's', 'first', 'android', 'news', 'source', 'phandroidcom', 'cover', 'android', 'news', 'review', 'and', 'tip', 'to', 'help', 'you', 'get', 'the', 'most', 'out', 'of', 'your', 'smartphone', 'or', 'tablet']","['world', 'first', 'android', 'news', 'source', 'phandroidcom', 'cover', 'android', 'news', 'review', 'tip', 'help', 'get', 'smartphone', 'tablet']",,aman
"pornhub is the world’s leading free porn site. choose from millions of hardcore videos that stream quickly and in high quality, including amazing vr porn. the largest adult site on the internet just keeps getting better. we have more pornstars and real amateurs than anyone else. it’s fast, it’s free, it’s pornhub!","pornhub is the world’s leading free porn site. choose from millions of hardcore videos that stream quickly and in high quality, including amazing vr porn. the largest adult site on the internet just keeps getting better. we have more pornstars and real amateurs than anyone else. it’s fast, it’s free, it’s pornhub!","pornhub is the world’s leading free porn site. choose from millions of hardcore videos that stream quickly and in high quality, including amazing vr porn. the largest adult site on the internet just keeps getting better. we have more pornstars and real amateurs than anyone else. it’s fast, it’s free, it’s pornhub!",pornhub is the world’s leading free porn site choose from millions of hardcore videos that stream quickly and in high quality including amazing vr porn the largest adult site on the internet just keeps getting better we have more pornstars and real amateurs than anyone else it’s fast it’s free it’s pornhub,"['pornhub', 'is', 'the', 'world', '’', 's', 'leading', 'free', 'porn', 'site', 'choose', 'from', 'millions', 'of', 'hardcore', 'videos', 'that', 'stream', 'quickly', 'and', 'in', 'high', 'quality', 'including', 'amazing', 'vr', 'porn', 'the', 'largest', 'adult', 'site', 'on', 'the', 'internet', 'just', 'keeps', 'getting', 'better', 'we', 'have', 'more', 'pornstars', 'and', 'real', 'amateurs', 'than', 'anyone', 'else', 'it', '’', 's', 'fast', 'it', '’', 's', 'free', 'it', '’', 's', 'pornhub']","['pornhub', 'be', 'the', 'world', '', 's', 'lead', 'free', 'porn', 'site', 'choose', 'from', 'million', 'of', 'hardcore', 'video', 'that', 'stream', 'quickly', 'and', 'in', 'high', 'quality', 'include', 'amaze', 'vr', 'porn', 'the', 'large', 'adult', 'site', 'on', 'the', 'internet', 'just', 'keep', 'get', 'well', 'we', 'have', 'more', 'pornstars', 'and', 'real', 'amateur', 'than', 'anyone', 'else', 'it', '', 's', 'fast', 'it', '', 's', 'free', 'it', '', 's', 'pornhub']","['pornhub', 'world', '', 'lead', 'free', 'porn', 'site', 'choose', 'million', 'hardcore', 'video', 'stream', 'quickly', 'high', 'quality', 'include', 'amaze', 'vr', 'porn', 'large', 'adult', 'site', 'internet', 'keep', 'get', 'well', 'pornstars', 'real', 'amateur', 'anyone', 'else', '', 'fast', '', 'free', '', 'pornhub']",,berbahaya
xvideos free porn videos,xvideos free porn videos,xvideos free porn videos,xvideos free porn videos,"['xvideos', 'free', 'porn', 'videos']","['xvideos', 'free', 'porn', 'video']","['xvideos', 'free', 'porn', 'video']",,berbahaya
"watch more than 5 million porn videos on xhamster for free. stream new xxx tube movies online, browse sex photos, date girls to fuck at xhamster!","watch more than  million porn videos on xhamster for free. stream new xxx tube movies online, browse sex photos, date girls to fuck at xhamster!","watch more than  million porn videos on xhamster for free. stream new xxx tube movies online, browse sex photos, date girls to fuck at xhamster!",watch more than million porn videos on xhamster for free stream new xxx tube movies online browse sex photos date girls to fuck at xhamster,"['watch', 'more', 'than', 'million', 'porn', 'videos', 'on', 'xhamster', 'for', 'free', 'stream', 'new', 'xxx', 'tube', 'movies', 'online', 'browse', 'sex', 'photos', 'date', 'girls', 'to', 'fuck', 'at', 'xhamster']","['watch', 'more', 'than', 'million', 'porn', 'video', 'on', 'xhamster', 'for', 'free', 'stream', 'new', 'xxx', 'tube', 'movie', 'online', 'browse', 'sex', 'photo', 'date', 'girl', 'to', 'fuck', 'at', 'xhamster']","['watch', 'million', 'porn', 'video', 'xhamster', 'free', 'stream', 'new', 'xxx', 'tube', 'movie', 'online', 'browse', 'sex', 'photo', 'date', 'girl', 'fuck', 'xhamster']",,berbahaya
"redtube brings you new porn videos every day for free. enjoy our xxx movies in high quality hd resolution on any device. get fully immersed with the latest virtual reality sex videos from top adult studios. stream all of the hottest porn movies from your favorite categories, pornstars and porn channels !","redtube brings you new porn videos every day for free. enjoy our xxx movies in high quality hd resolution on any device. get fully immersed with the latest virtual reality sex videos from top adult studios. stream all of the hottest porn movies from your favorite categories, pornstars and porn channels !","redtube brings you new porn videos every day for free. enjoy our xxx movies in high quality hd resolution on any device. get fully immersed with the latest virtual reality sex videos from top adult studios. stream all of the hottest porn movies from your favorite categories, pornstars and porn channels !",redtube brings you new porn videos every day for free enjoy our xxx movies in high quality hd resolution on any device get fully immersed with the latest virtual reality sex videos from top adult studios stream all of the hottest porn movies from your favorite categories pornstars and porn channels,"['redtube', 'brings', 'you', 'new', 'porn', 'videos', 'every', 'day', 'for', 'free', 'enjoy', 'our', 'xxx', 'movies', 'in', 'high', 'quality', 'hd', 'resolution', 'on', 'any', 'device', 'get', 'fully', 'immersed', 'with', 'the', 'latest', 'virtual', 'reality', 'sex', 'videos', 'from', 'top', 'adult', 'studios', 'stream', 'all', 'of', 'the', 'hottest', 'porn', 'movies', 'from', 'your', 'favorite', 'categories', 'pornstars', 'and', 'porn', 'channels']","['redtube', 'brings', 'you', 'new', 'porn', 'video', 'every', 'day', 'for', 'free', 'enjoy', 'our', 'xxx', 'movie', 'in', 'high', 'quality', 'hd', 'resolution', 'on', 'any', 'device', 'get', 'fully', 'immerse', 'with', 'the', 'late', 'virtual', 'reality', 'sex', 'video', 'from', 'top', 'adult', 'studio', 'stream', 'all', 'of', 'the', 'hottest', 'porn', 'movie', 'from', 'your', 'favorite', 'category', 'pornstars', 'and', 'porn', 'channel']","['redtube', 'brings', 'new', 'porn', 'video', 'every', 'day', 'free', 'enjoy', 'xxx', 'movie', 'high', 'quality', 'hd', 'resolution', 'device', 'get', 'fully', 'immerse', 'late', 'virtual', 'reality', 'sex', 'video', 'top', 'adult', 'studio', 'stream', 'hottest', 'porn', 'movie', 'favorite', 'category', 'pornstars', 'porn', 'channel']",,berbahaya
"xnxx delivers free sex movies and fast free porn videos (tube porn). now 10 million+ sex vids available for free! featuring hot pussy, sexy girls in xxx rated porn clips.","xnxx delivers free sex movies and fast free porn videos (tube porn). now  million+ sex vids available for free! featuring hot pussy, sexy girls in xxx rated porn clips.","xnxx delivers free sex movies and fast free porn videos (tube porn). now  million+ sex vids available for free! featuring hot pussy, sexy girls in xxx rated porn clips.",xnxx delivers free sex movies and fast free porn videos tube porn now million sex vids available for free featuring hot pussy sexy girls in xxx rated porn clips,"['xnxx', 'delivers', 'free', 'sex', 'movies', 'and', 'fast', 'free', 'porn', 'videos', 'tube', 'porn', 'now', 'million', 'sex', 'vids', 'available', 'for', 'free', 'featuring', 'hot', 'pussy', 'sexy', 'girls', 'in', 'xxx', 'rated', 'porn', 'clips']","['xnxx', 'delivers', 'free', 'sex', 'movie', 'and', 'fast', 'free', 'porn', 'video', 'tube', 'porn', 'now', 'million', 'sex', 'vids', 'available', 'for', 'free', 'feature', 'hot', 'pussy', 'sexy', 'girl', 'in', 'xxx', 'rat', 'porn', 'clip']","['xnxx', 'delivers', 'free', 'sex', 'movie', 'fast', 'free', 'porn', 'video', 'tube', 'porn', 'million', 'sex', 'vids', 'available', 'free', 'feature', 'hot', 'pussy', 'sexy', 'girl', 'xxx', 'rat', 'porn', 'clip']",,berbahaya
"myfreecams is the original free webcam community for adults, featuring live video chat with thousands of models, cam girls, amateurs and female content creators!","myfreecams is the original free webcam community for adults, featuring live video chat with thousands of models, cam girls, amateurs and female content creators!","myfreecams is the original free webcam community for adults, featuring live video chat with thousands of models, cam girls, amateurs and female content creators!",myfreecams is the original free webcam community for adults featuring live video chat with thousands of models cam girls amateurs and female content creators,"['myfreecams', 'is', 'the', 'original', 'free', 'webcam', 'community', 'for', 'adults', 'featuring', 'live', 'video', 'chat', 'with', 'thousands', 'of', 'models', 'cam', 'girls', 'amateurs', 'and', 'female', 'content', 'creators']","['myfreecams', 'be', 'the', 'original', 'free', 'webcam', 'community', 'for', 'adult', 'feature', 'live', 'video', 'chat', 'with', 'thousand', 'of', 'model', 'cam', 'girl', 'amateur', 'and', 'female', 'content', 'creator']","['myfreecams', 'original', 'free', 'webcam', 'community', 'adult', 'feature', 'live', 'video', 'chat', 'thousand', 'model', 'cam', 'girl', 'amateur', 'female', 'content', 'creator']",,berbahaya
youjizz porn tube! free porn movies and sex videos on your desktop or mobile phone.,youjizz porn tube! free porn movies and sex videos on your desktop or mobile phone.,youjizz porn tube! free porn movies and sex videos on your desktop or mobile phone.,youjizz porn tube free porn movies and sex videos on your desktop or mobile phone,"['youjizz', 'porn', 'tube', 'free', 'porn', 'movies', 'and', 'sex', 'videos', 'on', 'your', 'desktop', 'or', 'mobile', 'phone']","['youjizz', 'porn', 'tube', 'free', 'porn', 'movie', 'and', 'sex', 'video', 'on', 'your', 'desktop', 'or', 'mobile', 'phone']","['youjizz', 'porn', 'tube', 'free', 'porn', 'movie', 'sex', 'video', 'desktop', 'mobile', 'phone']",,berbahaya
"youporn is your home for free xxx porn videos. sit back and watch all of the unlimited, high quality hd porn your heart desires. enjoy the hottest porno movies from just about any category you can imagine. discover the sexiest naked pornstars and amateurs on earth, only on the world's favorite sex tube - youporn!","youporn is your home for free xxx porn videos. sit back and watch all of the unlimited, high quality hd porn your heart desires. enjoy the hottest porno movies from just about any category you can imagine. discover the sexiest naked pornstars and amateurs on earth, only on the world's favorite sex tube - youporn!","youporn is your home for free xxx porn videos. sit back and watch all of the unlimited, high quality hd porn your heart desires. enjoy the hottest porno movies from just about any category you can imagine. discover the sexiest naked pornstars and amateurs on earth, only on the world's favorite sex tube   youporn!",youporn is your home for free xxx porn videos sit back and watch all of the unlimited high quality hd porn your heart desires enjoy the hottest porno movies from just about any category you can imagine discover the sexiest naked pornstars and amateurs on earth only on the world's favorite sex tube youporn,"['youporn', 'is', 'your', 'home', 'for', 'free', 'xxx', 'porn', 'videos', 'sit', 'back', 'and', 'watch', 'all', 'of', 'the', 'unlimited', 'high', 'quality', 'hd', 'porn', 'your', 'heart', 'desires', 'enjoy', 'the', 'hottest', 'porno', 'movies', 'from', 'just', 'about', 'any', 'category', 'you', 'can', 'imagine', 'discover', 'the', 'sexiest', 'naked', 'pornstars', 'and', 'amateurs', 'on', 'earth', 'only', 'on', 'the', 'world', ""'s"", 'favorite', 'sex', 'tube', 'youporn']","['youporn', 'be', 'your', 'home', 'for', 'free', 'xxx', 'porn', 'video', 'sit', 'back', 'and', 'watch', 'all', 'of', 'the', 'unlimited', 'high', 'quality', 'hd', 'porn', 'your', 'heart', 'desire', 'enjoy', 'the', 'hottest', 'porno', 'movie', 'from', 'just', 'about', 'any', 'category', 'you', 'can', 'imagine', 'discover', 'the', 'sexiest', 'naked', 'pornstars', 'and', 'amateur', 'on', 'earth', 'only', 'on', 'the', 'world', 's', 'favorite', 'sex', 'tube', 'youporn']","['youporn', 'home', 'free', 'xxx', 'porn', 'video', 'sit', 'back', 'watch', 'unlimited', 'high', 'quality', 'hd', 'porn', 'heart', 'desire', 'enjoy', 'hottest', 'porno', 'movie', 'category', 'imagine', 'discover', 'sexiest', 'naked', 'pornstars', 'amateur', 'earth', 'world', 'favorite', 'sex', 'tube', 'youporn']",,berbahaya
watch the hottest free sex videos at tube8. enjoy an exclusive porn collection of selected sex scenes and full porn movies at home or on the go on your mobile device. tube8 is the porno tube with the fastest streaming hd videos.,watch the hottest free sex videos at tube. enjoy an exclusive porn collection of selected sex scenes and full porn movies at home or on the go on your mobile device. tube is the porno tube with the fastest streaming hd videos.,watch the hottest free sex videos at tube. enjoy an exclusive porn collection of selected sex scenes and full porn movies at home or on the go on your mobile device. tube is the porno tube with the fastest streaming hd videos.,watch the hottest free sex videos at tube enjoy an exclusive porn collection of selected sex scenes and full porn movies at home or on the go on your mobile device tube is the porno tube with the fastest streaming hd videos,"['watch', 'the', 'hottest', 'free', 'sex', 'videos', 'at', 'tube', 'enjoy', 'an', 'exclusive', 'porn', 'collection', 'of', 'selected', 'sex', 'scenes', 'and', 'full', 'porn', 'movies', 'at', 'home', 'or', 'on', 'the', 'go', 'on', 'your', 'mobile', 'device', 'tube', 'is', 'the', 'porno', 'tube', 'with', 'the', 'fastest', 'streaming', 'hd', 'videos']","['watch', 'the', 'hottest', 'free', 'sex', 'video', 'at', 'tube', 'enjoy', 'an', 'exclusive', 'porn', 'collection', 'of', 'select', 'sex', 'scene', 'and', 'full', 'porn', 'movie', 'at', 'home', 'or', 'on', 'the', 'go', 'on', 'your', 'mobile', 'device', 'tube', 'be', 'the', 'porno', 'tube', 'with', 'the', 'fast', 'stream', 'hd', 'video']","['watch', 'hottest', 'free', 'sex', 'video', 'tube', 'enjoy', 'exclusive', 'porn', 'collection', 'select', 'sex', 'scene', 'full', 'porn', 'movie', 'home', 'go', 'mobile', 'device', 'tube', 'porno', 'tube', 'fast', 'stream', 'hd', 'video']",,berbahaya
"watch real people naked & having sex live on webcam 24/7. 100% free to watch, chat & broadcast. no-sign up & no registration required.","watch real people naked & having sex live on webcam /. % free to watch, chat & broadcast. no-sign up & no registration required.","watch real people naked & having sex live on webcam /. % free to watch, chat & broadcast. no sign up & no registration required.",watch real people naked having sex live on webcam / free to watch chat broadcast no sign up no registration required,"['watch', 'real', 'people', 'naked', 'having', 'sex', 'live', 'on', 'webcam', '/', 'free', 'to', 'watch', 'chat', 'broadcast', 'no', 'sign', 'up', 'no', 'registration', 'required']","['watch', 'real', 'people', 'naked', 'have', 'sex', 'live', 'on', 'webcam', '', 'free', 'to', 'watch', 'chat', 'broadcast', 'no', 'sign', 'up', 'no', 'registration', 'require']","['watch', 'real', 'people', 'naked', 'sex', 'live', 'webcam', '', 'free', 'watch', 'chat', 'broadcast', 'sign', 'registration', 'require']",,berbahaya
"wear the playboy collection. styles include playboy logo clothing, hoodies, sweatshirts, sweatpants, earrings, necklaces and vintage looks. for men and women.","wear the playboy collection. styles include playboy logo clothing, hoodies, sweatshirts, sweatpants, earrings, necklaces and vintage looks. for men and women.","wear the playboy collection. styles include playboy logo clothing, hoodies, sweatshirts, sweatpants, earrings, necklaces and vintage looks. for men and women.",wear the playboy collection styles include playboy logo clothing hoodies sweatshirts sweatpants earrings necklaces and vintage looks for men and women,"['wear', 'the', 'playboy', 'collection', 'styles', 'include', 'playboy', 'logo', 'clothing', 'hoodies', 'sweatshirts', 'sweatpants', 'earrings', 'necklaces', 'and', 'vintage', 'looks', 'for', 'men', 'and', 'women']","['wear', 'the', 'playboy', 'collection', 'style', 'include', 'playboy', 'logo', 'clothing', 'hoodies', 'sweatshirt', 'sweatpants', 'earring', 'necklace', 'and', 'vintage', 'look', 'for', 'men', 'and', 'woman']","['wear', 'playboy', 'collection', 'style', 'include', 'playboy', 'logo', 'clothing', 'hoodies', 'sweatshirt', 'sweatpants', 'earring', 'necklace', 'vintage', 'look', 'men', 'woman']",,berbahaya
