d_case_folding,d_digits_removal,d_breaking_hyphens,d_punctuation_mark_removal,d_tokenizing,d_stemming,d_stopword_removal,,label
"we unlock the potential of millions of people. our qualiﬁcations, assessments, academic publications and original research spread knowledge and spark enquiry.","we unlock the potential of millions of people. our qualiﬁcations, assessments, academic publications and original research spread knowledge and spark enquiry.","we unlock the potential of millions of people. our qualiﬁcations, assessments, academic publications and original research spread knowledge and spark enquiry.",we unlock the potential of millions of people our qualiﬁcations assessments academic publications and original research spread knowledge and spark enquiry,"['we', 'unlock', 'the', 'potential', 'of', 'millions', 'of', 'people', 'our', 'qualiﬁcations', 'assessments', 'academic', 'publications', 'and', 'original', 'research', 'spread', 'knowledge', 'and', 'spark', 'enquiry']","['we', 'unlock', 'the', 'potential', 'of', 'million', 'of', 'people', 'our', 'quali cations', 'assessment', 'academic', 'publication', 'and', 'original', 'research', 'spread', 'knowledge', 'and', 'spark', 'enquiry']","['unlock', 'potential', 'million', 'people', 'quali cations', 'assessment', 'academic', 'publication', 'original', 'research', 'spread', 'knowledge', 'spark', 'enquiry']",,aman
improve knowedge of vocabulary words with spelling practice from vocabularyspellingcity. our engaging phonics games for kids help students become spelling masters.,improve knowedge of vocabulary words with spelling practice from vocabularyspellingcity. our engaging phonics games for kids help students become spelling masters.,improve knowedge of vocabulary words with spelling practice from vocabularyspellingcity. our engaging phonics games for kids help students become spelling masters.,improve knowedge of vocabulary words with spelling practice from vocabularyspellingcity our engaging phonics games for kids help students become spelling masters,"['improve', 'knowedge', 'of', 'vocabulary', 'words', 'with', 'spelling', 'practice', 'from', 'vocabularyspellingcity', 'our', 'engaging', 'phonics', 'games', 'for', 'kids', 'help', 'students', 'become', 'spelling', 'masters']","['improve', 'knowedge', 'of', 'vocabulary', 'word', 'with', 'spell', 'practice', 'from', 'vocabularyspellingcity', 'our', 'engage', 'phonics', 'game', 'for', 'kid', 'help', 'student', 'become', 'spell', 'master']","['improve', 'knowedge', 'vocabulary', 'word', 'spell', 'practice', 'vocabularyspellingcity', 'engage', 'phonics', 'game', 'kid', 'help', 'student', 'become', 'spell', 'master']",,aman
"live science features groundbreaking developments in science, space, technology, health, the environment, our culture and history.","live science features groundbreaking developments in science, space, technology, health, the environment, our culture and history.","live science features groundbreaking developments in science, space, technology, health, the environment, our culture and history.",live science features groundbreaking developments in science space technology health the environment our culture and history,"['live', 'science', 'features', 'groundbreaking', 'developments', 'in', 'science', 'space', 'technology', 'health', 'the', 'environment', 'our', 'culture', 'and', 'history']","['live', 'science', 'feature', 'groundbreaking', 'development', 'in', 'science', 'space', 'technology', 'health', 'the', 'environment', 'our', 'culture', 'and', 'history']","['live', 'science', 'feature', 'groundbreaking', 'development', 'science', 'space', 'technology', 'health', 'environment', 'culture', 'history']",,aman
"shop online for the newest nissan cars, trucks, crossovers, suvs and electric vehicles. explore offers, compare models, calculate payments and more.","shop online for the newest nissan cars, trucks, crossovers, suvs and electric vehicles. explore offers, compare models, calculate payments and more.","shop online for the newest nissan cars, trucks, crossovers, suvs and electric vehicles. explore offers, compare models, calculate payments and more.",shop online for the newest nissan cars trucks crossovers suvs and electric vehicles explore offers compare models calculate payments and more,"['shop', 'online', 'for', 'the', 'newest', 'nissan', 'cars', 'trucks', 'crossovers', 'suvs', 'and', 'electric', 'vehicles', 'explore', 'offers', 'compare', 'models', 'calculate', 'payments', 'and', 'more']","['shop', 'online', 'for', 'the', 'new', 'nissan', 'car', 'truck', 'crossover', 'suv', 'and', 'electric', 'vehicle', 'explore', 'offer', 'compare', 'model', 'calculate', 'payment', 'and', 'more']","['shop', 'online', 'new', 'nissan', 'car', 'truck', 'crossover', 'suv', 'electric', 'vehicle', 'explore', 'offer', 'compare', 'model', 'calculate', 'payment']",,aman
"acs is one of the world’s largest scientific societies and the premier home of chemistry professionals. find career opportunities, educational resources and more.","acs is one of the world’s largest scientific societies and the premier home of chemistry professionals. find career opportunities, educational resources and more.","acs is one of the world’s largest scientific societies and the premier home of chemistry professionals. find career opportunities, educational resources and more.",acs is one of the world’s largest scientific societies and the premier home of chemistry professionals find career opportunities educational resources and more,"['acs', 'is', 'one', 'of', 'the', 'world', '’', 's', 'largest', 'scientific', 'societies', 'and', 'the', 'premier', 'home', 'of', 'chemistry', 'professionals', 'find', 'career', 'opportunities', 'educational', 'resources', 'and', 'more']","['ac', 'be', 'one', 'of', 'the', 'world', '', 's', 'large', 'scientific', 'society', 'and', 'the', 'premier', 'home', 'of', 'chemistry', 'professional', 'find', 'career', 'opportunity', 'educational', 'resource', 'and', 'more']","['ac', 'one', 'world', '', 'large', 'scientific', 'society', 'premier', 'home', 'chemistry', 'professional', 'find', 'career', 'opportunity', 'educational', 'resource']",,aman
"official site of san francisco state university, a public urban university with a conscience located in one of the world's most vibrant and beautiful cities. begin your college search here for world-class undergraduate study, graduate study, scholarly research and community service learning.","official site of san francisco state university, a public urban university with a conscience located in one of the world's most vibrant and beautiful cities. begin your college search here for world-class undergraduate study, graduate study, scholarly research and community service learning.","official site of san francisco state university, a public urban university with a conscience located in one of the world's most vibrant and beautiful cities. begin your college search here for world class undergraduate study, graduate study, scholarly research and community service learning.",official site of san francisco state university a public urban university with a conscience located in one of the world's most vibrant and beautiful cities begin your college search here for world class undergraduate study graduate study scholarly research and community service learning,"['official', 'site', 'of', 'san', 'francisco', 'state', 'university', 'a', 'public', 'urban', 'university', 'with', 'a', 'conscience', 'located', 'in', 'one', 'of', 'the', 'world', ""'s"", 'most', 'vibrant', 'and', 'beautiful', 'cities', 'begin', 'your', 'college', 'search', 'here', 'for', 'world', 'class', 'undergraduate', 'study', 'graduate', 'study', 'scholarly', 'research', 'and', 'community', 'service', 'learning']","['official', 'site', 'of', 'san', 'francisco', 'state', 'university', 'a', 'public', 'urban', 'university', 'with', 'a', 'conscience', 'locate', 'in', 'one', 'of', 'the', 'world', 's', 'most', 'vibrant', 'and', 'beautiful', 'city', 'begin', 'your', 'college', 'search', 'here', 'for', 'world', 'class', 'undergraduate', 'study', 'graduate', 'study', 'scholarly', 'research', 'and', 'community', 'service', 'learn']","['official', 'site', 'san', 'francisco', 'state', 'university', 'public', 'urban', 'university', 'conscience', 'locate', 'one', 'world', 'vibrant', 'beautiful', 'city', 'begin', 'college', 'search', 'world', 'class', 'undergraduate', 'study', 'graduate', 'study', 'scholarly', 'research', 'community', 'service', 'learn']",,aman
latest iphone/ipad app news and reviews,latest iphone/ipad app news and reviews,latest iphone/ipad app news and reviews,latest iphone/ipad app news and reviews,"['latest', 'iphone/ipad', 'app', 'news', 'and', 'reviews']","['late', 'iphone ipad', 'app', 'news', 'and', 'review']","['late', 'iphone ipad', 'app', 'news', 'review']",,aman
"the world's most advanced graphics cards, gaming solutions, and gaming technology - from nvidia geforce.","the world's most advanced graphics cards, gaming solutions, and gaming technology - from nvidia geforce.","the world's most advanced graphics cards, gaming solutions, and gaming technology   from nvidia geforce.",the world's most advanced graphics cards gaming solutions and gaming technology from nvidia geforce,"['the', 'world', ""'s"", 'most', 'advanced', 'graphics', 'cards', 'gaming', 'solutions', 'and', 'gaming', 'technology', 'from', 'nvidia', 'geforce']","['the', 'world', 's', 'most', 'advanced', 'graphic', 'card', 'game', 'solution', 'and', 'game', 'technology', 'from', 'nvidia', 'geforce']","['world', 'advanced', 'graphic', 'card', 'game', 'solution', 'game', 'technology', 'nvidia', 'geforce']",,aman
uc santa barbara is a leading center for teaching and research located on the california coast - truly a learning and living environment like no other!,uc santa barbara is a leading center for teaching and research located on the california coast - truly a learning and living environment like no other!,uc santa barbara is a leading center for teaching and research located on the california coast   truly a learning and living environment like no other!,uc santa barbara is a leading center for teaching and research located on the california coast truly a learning and living environment like no other,"['uc', 'santa', 'barbara', 'is', 'a', 'leading', 'center', 'for', 'teaching', 'and', 'research', 'located', 'on', 'the', 'california', 'coast', 'truly', 'a', 'learning', 'and', 'living', 'environment', 'like', 'no', 'other']","['uc', 'santa', 'barbara', 'be', 'a', 'lead', 'center', 'for', 'teach', 'and', 'research', 'locate', 'on', 'the', 'california', 'coast', 'truly', 'a', 'learn', 'and', 'living', 'environment', 'like', 'no', 'other']","['uc', 'santa', 'barbara', 'lead', 'center', 'teach', 'research', 'locate', 'california', 'coast', 'truly', 'learn', 'living', 'environment', 'like']",,aman
"get the inside scoop on new cars: car reviews, car photos, test drive results, technical specs and more. comprehensive car reviews from auto experts. get expert opinions from new car test drives. find cool cars and get inside exclusives on hot concept cars, spy shots with auto show blogging coverage and daily automotive industry news.","get the inside scoop on new cars: car reviews, car photos, test drive results, technical specs and more. comprehensive car reviews from auto experts. get expert opinions from new car test drives. find cool cars and get inside exclusives on hot concept cars, spy shots with auto show blogging coverage and daily automotive industry news.","get the inside scoop on new cars: car reviews, car photos, test drive results, technical specs and more. comprehensive car reviews from auto experts. get expert opinions from new car test drives. find cool cars and get inside exclusives on hot concept cars, spy shots with auto show blogging coverage and daily automotive industry news.",get the inside scoop on new cars car reviews car photos test drive results technical specs and more comprehensive car reviews from auto experts get expert opinions from new car test drives find cool cars and get inside exclusives on hot concept cars spy shots with auto show blogging coverage and daily automotive industry news,"['get', 'the', 'inside', 'scoop', 'on', 'new', 'cars', 'car', 'reviews', 'car', 'photos', 'test', 'drive', 'results', 'technical', 'specs', 'and', 'more', 'comprehensive', 'car', 'reviews', 'from', 'auto', 'experts', 'get', 'expert', 'opinions', 'from', 'new', 'car', 'test', 'drives', 'find', 'cool', 'cars', 'and', 'get', 'inside', 'exclusives', 'on', 'hot', 'concept', 'cars', 'spy', 'shots', 'with', 'auto', 'show', 'blogging', 'coverage', 'and', 'daily', 'automotive', 'industry', 'news']","['get', 'the', 'inside', 'scoop', 'on', 'new', 'car', 'car', 'review', 'car', 'photo', 'test', 'drive', 'result', 'technical', 'spec', 'and', 'more', 'comprehensive', 'car', 'review', 'from', 'auto', 'expert', 'get', 'expert', 'opinion', 'from', 'new', 'car', 'test', 'drive', 'find', 'cool', 'car', 'and', 'get', 'inside', 'exclusive', 'on', 'hot', 'concept', 'car', 'spy', 'shot', 'with', 'auto', 'show', 'blogging', 'coverage', 'and', 'daily', 'automotive', 'industry', 'news']","['get', 'inside', 'scoop', 'new', 'car', 'car', 'review', 'car', 'photo', 'test', 'drive', 'result', 'technical', 'spec', 'comprehensive', 'car', 'review', 'auto', 'expert', 'get', 'expert', 'opinion', 'new', 'car', 'test', 'drive', 'find', 'cool', 'car', 'get', 'inside', 'exclusive', 'hot', 'concept', 'car', 'spy', 'shot', 'auto', 'show', 'blogging', 'coverage', 'daily', 'automotive', 'industry', 'news']",,aman
"top tech blog publishing blogging tips, smart tech and web tutorials since 2004","top tech blog publishing blogging tips, smart tech and web tutorials since ","top tech blog publishing blogging tips, smart tech and web tutorials since ",top tech blog publishing blogging tips smart tech and web tutorials since,"['top', 'tech', 'blog', 'publishing', 'blogging', 'tips', 'smart', 'tech', 'and', 'web', 'tutorials', 'since']","['top', 'tech', 'blog', 'publishing', 'blogging', 'tip', 'smart', 'tech', 'and', 'web', 'tutorial', 'since']","['top', 'tech', 'blog', 'publishing', 'blogging', 'tip', 'smart', 'tech', 'web', 'tutorial', 'since']",,aman
explore an innovative line of quality products from american honda motor company. find the latest news and information on honda and acura brand products.,explore an innovative line of quality products from american honda motor company. find the latest news and information on honda and acura brand products.,explore an innovative line of quality products from american honda motor company. find the latest news and information on honda and acura brand products.,explore an innovative line of quality products from american honda motor company find the latest news and information on honda and acura brand products,"['explore', 'an', 'innovative', 'line', 'of', 'quality', 'products', 'from', 'american', 'honda', 'motor', 'company', 'find', 'the', 'latest', 'news', 'and', 'information', 'on', 'honda', 'and', 'acura', 'brand', 'products']","['explore', 'an', 'innovative', 'line', 'of', 'quality', 'product', 'from', 'american', 'honda', 'motor', 'company', 'find', 'the', 'late', 'news', 'and', 'information', 'on', 'honda', 'and', 'acura', 'brand', 'product']","['explore', 'innovative', 'line', 'quality', 'product', 'american', 'honda', 'motor', 'company', 'find', 'late', 'news', 'information', 'honda', 'acura', 'brand', 'product']",,aman
"situs resmi harley-davidson motor company. lihat motor harley terbaru, cari dealer, & telusuri komponen dan perlengkapan motor.","situs resmi harley-davidson motor company. lihat motor harley terbaru, cari dealer, & telusuri komponen dan perlengkapan motor.","situs resmi harley davidson motor company. lihat motor harley terbaru, cari dealer, & telusuri komponen dan perlengkapan motor.",situs resmi harley davidson motor company lihat motor harley terbaru cari dealer telusuri komponen dan perlengkapan motor,"['situs', 'resmi', 'harley', 'davidson', 'motor', 'company', 'lihat', 'motor', 'harley', 'terbaru', 'cari', 'dealer', 'telusuri', 'komponen', 'dan', 'perlengkapan', 'motor']","['situs', 'resmi', 'harley', 'davidson', 'motor', 'company', 'lihat', 'motor', 'harley', 'baru', 'cari', 'dealer', 'telusur', 'komponen', 'dan', 'lengkap', 'motor']","['situs', 'resmi', 'harley', 'davidson', 'motor', 'company', 'lihat', 'motor', 'harley', 'cari', 'dealer', 'telusur', 'komponen', 'lengkap', 'motor']",,aman
"udemy is an online learning and teaching marketplace with over 185,000 courses and 49 million students. learn programming, marketing, data science and more.","udemy is an online learning and teaching marketplace with over , courses and  million students. learn programming, marketing, data science and more.","udemy is an online learning and teaching marketplace with over , courses and  million students. learn programming, marketing, data science and more.",udemy is an online learning and teaching marketplace with over courses and million students learn programming marketing data science and more,"['udemy', 'is', 'an', 'online', 'learning', 'and', 'teaching', 'marketplace', 'with', 'over', 'courses', 'and', 'million', 'students', 'learn', 'programming', 'marketing', 'data', 'science', 'and', 'more']","['udemy', 'be', 'an', 'online', 'learn', 'and', 'teach', 'marketplace', 'with', 'over', 'course', 'and', 'million', 'student', 'learn', 'program', 'marketing', 'data', 'science', 'and', 'more']","['udemy', 'online', 'learn', 'teach', 'marketplace', 'course', 'million', 'student', 'learn', 'program', 'marketing', 'data', 'science']",,aman
access 130+ million publications and connect with 20+ million researchers. join for free and gain visibility by uploading your research.,access + million publications and connect with + million researchers. join for free and gain visibility by uploading your research.,access + million publications and connect with + million researchers. join for free and gain visibility by uploading your research.,access million publications and connect with million researchers join for free and gain visibility by uploading your research,"['access', 'million', 'publications', 'and', 'connect', 'with', 'million', 'researchers', 'join', 'for', 'free', 'and', 'gain', 'visibility', 'by', 'uploading', 'your', 'research']","['access', 'million', 'publication', 'and', 'connect', 'with', 'million', 'researcher', 'join', 'for', 'free', 'and', 'gain', 'visibility', 'by', 'upload', 'your', 'research']","['access', 'million', 'publication', 'connect', 'million', 'researcher', 'join', 'free', 'gain', 'visibility', 'upload', 'research']",,aman
"share our collection of inspirational and famous quotes by authors you know and love. share our quotes of the day on the web, facebook, twitter, and blogs.","share our collection of inspirational and famous quotes by authors you know and love. share our quotes of the day on the web, facebook, twitter, and blogs.","share our collection of inspirational and famous quotes by authors you know and love. share our quotes of the day on the web, facebook, twitter, and blogs.",share our collection of inspirational and famous quotes by authors you know and love share our quotes of the day on the web facebook twitter and blogs,"['share', 'our', 'collection', 'of', 'inspirational', 'and', 'famous', 'quotes', 'by', 'authors', 'you', 'know', 'and', 'love', 'share', 'our', 'quotes', 'of', 'the', 'day', 'on', 'the', 'web', 'facebook', 'twitter', 'and', 'blogs']","['share', 'our', 'collection', 'of', 'inspirational', 'and', 'famous', 'quote', 'by', 'author', 'you', 'know', 'and', 'love', 'share', 'our', 'quote', 'of', 'the', 'day', 'on', 'the', 'web', 'facebook', 'twitter', 'and', 'blog']","['share', 'collection', 'inspirational', 'famous', 'quote', 'author', 'know', 'love', 'share', 'quote', 'day', 'web', 'facebook', 'twitter', 'blog']",,aman
"your buyer’s guide for the best android phones, deals, news, and reviews! android central covers smartphones, watches, tablets, chromeos devices, google home, and all compatible peripherals in this smart world we're living in. read all this and more on android central.","your buyer’s guide for the best android phones, deals, news, and reviews! android central covers smartphones, watches, tablets, chromeos devices, google home, and all compatible peripherals in this smart world we're living in. read all this and more on android central.","your buyer’s guide for the best android phones, deals, news, and reviews! android central covers smartphones, watches, tablets, chromeos devices, google home, and all compatible peripherals in this smart world we're living in. read all this and more on android central.",your buyer’s guide for the best android phones deals news and reviews android central covers smartphones watches tablets chromeos devices google home and all compatible peripherals in this smart world we're living in read all this and more on android central,"['your', 'buyer', '’', 's', 'guide', 'for', 'the', 'best', 'android', 'phones', 'deals', 'news', 'and', 'reviews', 'android', 'central', 'covers', 'smartphones', 'watches', 'tablets', 'chromeos', 'devices', 'google', 'home', 'and', 'all', 'compatible', 'peripherals', 'in', 'this', 'smart', 'world', 'we', ""'re"", 'living', 'in', 'read', 'all', 'this', 'and', 'more', 'on', 'android', 'central']","['your', 'buyer', '', 's', 'guide', 'for', 'the', 'best', 'android', 'phone', 'deal', 'news', 'and', 'review', 'android', 'central', 'cover', 'smartphones', 'watch', 'tablet', 'chromeos', 'device', 'google', 'home', 'and', 'all', 'compatible', 'peripheral', 'in', 'this', 'smart', 'world', 'we', 're', 'living', 'in', 'read', 'all', 'this', 'and', 'more', 'on', 'android', 'central']","['buyer', '', 'guide', 'best', 'android', 'phone', 'deal', 'news', 'review', 'android', 'central', 'cover', 'smartphones', 'watch', 'tablet', 'chromeos', 'device', 'google', 'home', 'compatible', 'peripheral', 'smart', 'world', 'living', 'read', 'android', 'central']",,aman
"get the latest space exploration, innovation and astronomy news. space.com celebrates humanity's ongoing expansion across the final frontier.","get the latest space exploration, innovation and astronomy news. space.com celebrates humanity's ongoing expansion across the final frontier.","get the latest space exploration, innovation and astronomy news. space.com celebrates humanity's ongoing expansion across the final frontier.",get the latest space exploration innovation and astronomy news spacecom celebrates humanity's ongoing expansion across the final frontier,"['get', 'the', 'latest', 'space', 'exploration', 'innovation', 'and', 'astronomy', 'news', 'spacecom', 'celebrates', 'humanity', ""'s"", 'ongoing', 'expansion', 'across', 'the', 'final', 'frontier']","['get', 'the', 'late', 'space', 'exploration', 'innovation', 'and', 'astronomy', 'news', 'spacecom', 'celebrates', 'humanity', 's', 'ongoing', 'expansion', 'across', 'the', 'final', 'frontier']","['get', 'late', 'space', 'exploration', 'innovation', 'astronomy', 'news', 'spacecom', 'celebrates', 'humanity', 'ongoing', 'expansion', 'across', 'final', 'frontier']",,aman
"seagate membantu dunia menyimpan lebih banyak data dan memanfaatkan potensinya dengan terobosan layanan penyimpanan cloud, sistem, hard disk, hard disk solid state, serta solusi manajemen data lengkap.","seagate membantu dunia menyimpan lebih banyak data dan memanfaatkan potensinya dengan terobosan layanan penyimpanan cloud, sistem, hard disk, hard disk solid state, serta solusi manajemen data lengkap.","seagate membantu dunia menyimpan lebih banyak data dan memanfaatkan potensinya dengan terobosan layanan penyimpanan cloud, sistem, hard disk, hard disk solid state, serta solusi manajemen data lengkap.",seagate membantu dunia menyimpan lebih banyak data dan memanfaatkan potensinya dengan terobosan layanan penyimpanan cloud sistem hard disk hard disk solid state serta solusi manajemen data lengkap,"['seagate', 'membantu', 'dunia', 'menyimpan', 'lebih', 'banyak', 'data', 'dan', 'memanfaatkan', 'potensinya', 'dengan', 'terobosan', 'layanan', 'penyimpanan', 'cloud', 'sistem', 'hard', 'disk', 'hard', 'disk', 'solid', 'state', 'serta', 'solusi', 'manajemen', 'data', 'lengkap']","['seagate', 'bantu', 'dunia', 'simpan', 'lebih', 'banyak', 'data', 'dan', 'manfaat', 'potensi', 'dengan', 'terobos', 'layan', 'simpan', 'cloud', 'sistem', 'hard', 'disk', 'hard', 'disk', 'solid', 'state', 'serta', 'solusi', 'manajemen', 'data', 'lengkap']","['seagate', 'bantu', 'dunia', 'simpan', 'data', 'manfaat', 'potensi', 'terobos', 'layan', 'simpan', 'cloud', 'sistem', 'hard', 'disk', 'hard', 'disk', 'solid', 'state', 'solusi', 'manajemen', 'data', 'lengkap']",,aman
"join a global community of renowned artists, pioneering scientists, and faculty dedicated to student success at the university of iowa.","join a global community of renowned artists, pioneering scientists, and faculty dedicated to student success at the university of iowa.","join a global community of renowned artists, pioneering scientists, and faculty dedicated to student success at the university of iowa.",join a global community of renowned artists pioneering scientists and faculty dedicated to student success at the university of iowa,"['join', 'a', 'global', 'community', 'of', 'renowned', 'artists', 'pioneering', 'scientists', 'and', 'faculty', 'dedicated', 'to', 'student', 'success', 'at', 'the', 'university', 'of', 'iowa']","['join', 'a', 'global', 'community', 'of', 'renowned', 'artist', 'pioneer', 'scientist', 'and', 'faculty', 'dedicate', 'to', 'student', 'success', 'at', 'the', 'university', 'of', 'iowa']","['join', 'global', 'community', 'renowned', 'artist', 'pioneer', 'scientist', 'faculty', 'dedicate', 'student', 'success', 'university', 'iowa']",,aman
