,Unnamed: 0,Unnamed: 0.1,Category,url,Description,description,title
0,0,0,Education,https://wikipedia.org,"Wikipedia - Wikipedia, the free encyclopedia that anyone can edit.","Wikipedia is a free online encyclopedia, created and edited by volunteers around the world and hosted by the Wikimedia Foundation.",Wikipedia
1,1,1,Education,https://thefreedictionary.com,"Dictionary, Encyclopedia and Thesaurus - The Free Dictionary - Online Dictionary - Multiple dictionaries including: English dictionary, medical dictionary, legal dictionary, financial dictionary, computer dictionary, thesaurus, dictionary of acronyms and abbreviations, dictionary of idioms, thesaur","The World's most comprehensive free online dictionary, thesaurus, and encyclopedia with synonyms, definitions, idioms, abbreviations, and medical, financial, legal specialized dictionaries","Dictionary, Encyclopedia and Thesaurus - The Free Dictionary"
2,2,2,Education,https://khanacademy.org,"Khan Academy - With a library of over 3,000 videos covering everything from arithmetic to physics, finance, and history and hundreds of skills to practice, we're on a mission to help you learn what you want, when you want, at your own pace.","Learn for free about math, art, computer programming, economics, physics, chemistry, biology, medicine, finance, history, and more. Khan Academy is a nonprofit with the mission of providing a free, world-class education for anyone, anywhere.","Khan Academy | Free Online Courses, Lessons & Practice"
3,3,3,Education,https://reference.com,Reference.com - A Free Online Encyclopedia & Information Reference - Reference.com - a free online encyclopedia and information reference. Research articles from Columbia Encyclopedia and Encyclopedia Britannica.,"Whether you're interested in history, science or culture, there's something for everyone on Reference.",Reference.com - What's Your Question?
4,4,4,Education,https://urbandictionary.com,"Urban Dictionary, January 29: reaching on a double",Whole nother may have evolved from another but experts are baffled so its true meaning remains unknown.,"Urban Dictionary, June 1: whole nother"
5,5,5,Education,https://lynda.com,"Software training online-tutorials for Adobe, Microsoft, Apple & more - Software training & tutorial video library. Our online courses help you learn critical skills. Free access & previews on hundreds of tutorials.","Learn business, creative, and technology skills to achieve your personal and professional goals. Join LinkedIn Learning today to get access to thousands of courses. Lynda is now LinkedIn Learning.","LinkedIn Learning with Lynda: Online Training Courses for Creative, Technology, Business Skills"
6,6,6,Education,https://m-w.com,"Dictionary and Thesaurus - Merriam-Webster Online - Free online dictionary, thesaurus, spanish-english and medical dictionaries, audio pronunciations, Word of the Day, word games, and many more high-quality Merriam-Webster language resources.","The dictionary by Merriam-Webster is America's most trusted online dictionary for English word definitions, meanings, and pronunciation. #wordsmatter",Dictionary by Merriam-Webster: America's most-trusted online dictionary
7,7,7,Education,https://wikimedia.org,Wikimedia - Wikimedia is a global movement whose mission is to bring free educational content to the world.,Wikimedia is a global movement whose mission is to bring free educational content to the world.,Wikimedia
8,8,8,Education,https://quizlet.com,"Simple free learning tools for students and teachers | Quizlet - We make simple learning tools that let you study anything, for free.",error,error
9,9,9,Education,https://starfall.com,"Starfall's Learn to Read with phonics - A free website to teach children to read with phonics.  For preschool, kindergarten, and first grade. Exciting phonics games and online interactive books.","At Starfall, children have fun while they learn - specializing in reading, phonics & math - educational games, movies, books, songs, and more for children K-3.","Starfall Education: Kids Games, Movies, & Books K-3"
10,10,10,Education,https://wordreference.com,"English to French, Italian, German & Spanish Dictionary - WordReference.com - Free online Oxford dictionaries - Spanish, French, Italian, German and more. Conjugations, audio pronunciations and forums for your questions.","Free online dictionaries - Spanish, French, Italian, German and more. Conjugations, audio pronunciations and forums for your questions.","English to French, Italian, German & Spanish Dictionary - WordReference.com"
11,11,11,Education,https://harvard.edu,"Harvard University - Harvard University, which celebrated its 375th anniversary in 2011, is the oldest institution of higher learning in the United States. Harvard University is devoted to excellence in teaching, learning, and research, and to developing leaders in many disciplines who make a diffe","Harvard University is devoted to excellence in teaching, learning, and research, and to developing leaders who make a difference globally.",Harvard University
12,12,12,Education,https://edmodo.com,"Edmodo | Where Learning Happens | Sign up, Sign In - Edmodo provides a safe and easy way for your class to connect and collaborate, share content, and access homework, grades and school notices. Our goal is to help educators harness the power of social media to customize the classroom for each and ",,
13,13,13,Education,https://brainyquote.com,"Famous Quotes at BrainyQuote - Share our extensive collection of famous quotes by authors, celebrities, newsmakers, and more. Enjoy our Quotes of the Day on the web, Facebook, and blogs.","Share our collection of inspirational and famous quotes by authors you know and love. Share our Quotes of the Day on the web, Facebook, Twitter, and blogs.",Inspirational Quotes at BrainyQuote
14,14,14,Education,https://coolmath-games.com,"Cool Math Games - Free Online Math Games, Cool Puzzles, Mazes and Coloring Pages for Kids of All Ages - Cool Math Games has cool free online games to learn math, reading and spelling, geography, science, strategy, skill, arithmetic, shapes and colors, logic and memory skills.  We've got very cool j",error,error
15,15,15,Education,https://blackboard.com,"Blackboard | Technology and Solutions Built for Education   - Blackboard helps clients enrich all aspects of the education experience by engaging and assessing learners, making their daily lives more convenient and secure, and keeping them informed and aware of the most important information.","Blackboard is a leading global educational technology solution for Higher Ed, K-12, business, and government, connecting education to the power of technology.",Educational Technology Services | Blackboard | North America
16,16,16,Education,https://codecademy.com,Learn to code | Codecademy,error,error
17,17,17,Education,https://ed.gov,U.S. Department of Education,,Home | U.S. Department of Education
18,18,18,Education,https://turnitin.com,"Turnitin : Leading Plagiarism Checker, Online Grading and Peer Review - Leading academic plagiarism checker technology for teachers and students. Online plagiarism detection, grammar check, grading tools.","Turnitin solutions promote academic integrity, streamline grading and feedback, deter plagiarism, and improve student outcomes.","Empower Students to Do Their Best, Original Work | Turnitin"
19,19,19,Education,https://phoenix.edu,"Online Schools, Classes, Degree Programs - University of Phoenix - University of Phoenix offers campus and online degree programs, certificate courses, and individual online classes. Learn more about admissions, accreditation, tuition and financial aid options, or get started with your enrollment t",University of Phoenix offers online degrees & courses aligned to 300+ occupations. Explore tuition-saving opportunities at our accredited online college!,"Online College, Affordable & Always On | University of Phoenix"
20,20,20,Education,https://sporcle.com,"Sporcle | Mentally Stimulating Diversions | Online Games & Trivia by Sporcle - Play thousands of free online trivia quizzes about Geography, History, Sports, Music, TV and more!",error,error
21,21,21,Education,https://collegeboard.org,College Admissions - SAT - University & College Search Tool - Get connected to your college. Find official college planning and preparation tools to help you succeed. Visit the College Board website - your inside source.,,"College Board - SAT, AP, College Search and Admission Tools"
22,22,22,Education,https://stanford.edu,"Stanford University - Stanford University is one of the world's leading research and teaching institutions.  It is located in Stanford, California.","One of the world's leading research and teaching institutions. Catalyzing discovery, accelerating solutions, sustaining life on Earth, and preparing students for active citizenship.",Stanford University
23,23,23,Education,https://ixl.com,"IXL Math | Online math practice and lessons - IXL is the Web's most comprehensive math practice site. Popular among educators and families, IXL provides unlimited questions in more than 2,000 topics. An adaptive learning system, featuring games and awards, inspires students to achieve.","IXL is the world's most popular subscription-based learning site for K–12. Used by over 13 million students, IXL provides personalized learning in more than 8,500 topics, covering math, language arts, science, social studies, and Spanish. Interactive questions, awards, and certificates keep kids motivated as they master skills.","IXL | Math, Language Arts, Science, Social Studies, and Spanish"
24,24,24,Education,https://funbrain.com,"FunBrain.com - The Internet's #1 Education Site for K-8 Kids and Teachers - Funbrain.com - FunBrain is the #1 site for online educational games for kids of all ages. (math, grammar, science, spelling, history)","Funbrain is the leader in online educational interactive content, with hundreds of free games, books & videos for kids of all ages. Check out Funbrain here.",Free Online Learning & Education For Kids | Funbrain - Funbrain
25,25,25,Education,https://ratemyprofessors.com,"Rate My Professors – Find and rate your professor, campus and more – RateMyProfessors.com - Over 1.5 million professors & 13 million opinions. Rate My Professors is the best professor ratings source based on student feedback. Find & rate a professor!","With over 1.3 million professors, 7,000 schools &amp; 15 million ratings, Rate My Professors is the best professor ratings source based on student feedback. Find &amp; rate your professors or school! #LeaveYourMark",Rate My Professors
26,26,26,Education,https://k12.com,"K12 | Online Public School, Online High School, Online Private School, Homeschooling, and Online Courses options - K12 is the number one choice in K-12 online education programs in America. K12 is the trusted provider of online learning for many tuition-free, virtual public schools, as well as home","K12 is a trusted provider of online learning for many virtual public schools, as well as homeschooling. Take charge of your child’s education & enroll now.",K12: Online Public School Programs | Online Learning Programs
27,27,27,Education,https://berkeley.edu,"University of California, Berkeley - University of California, Berkeley home page. Gateway to information on studying, teaching, research and public service at UC Berkeley, flagship campus of the University of California system.",,"Home | University of California, Berkeley"
28,28,28,Education,https://utexas.edu,Home | The University of Texas at Austin,"The University of Texas at Austin is a bold, ambitious leader, providing a first-class education and the tools of discovery to more than 51,000 students.",The University of Texas at Austin
29,29,29,Education,https://mentalfloss.com,"Random, Interesting, Amazing Facts - Fun Quizzes and Trivia | Mental Floss - Test your knowledge with amazing and interesting facts, trivia, quizzes, and brain teaser games on MentalFloss.com.","Test your knowledge with amazing and interesting facts, trivia, quizzes, and brain teaser games on MentalFloss.com.",Mental Floss
30,30,30,Education,https://umich.edu,"University of Michigan - University of Michigan is one of the top universities of the world, a diverse public institution of higher learning, fostering excellence in research. U-M provides outstanding undergraduate, graduate and professional education, serving the local, regional, national and inte","A top-ranked public university, the University of Michigan has a tradition of excellence in research, learning and teaching, sports and the arts, and more.",University of Michigan
31,31,31,Education,https://yourdictionary.com,"Dictionary definitions you can understand - YourDictionary - The easy to understand dictionary with example sentences, famous quotes and audio pronunciations. Includes: thesaurus, business dictionary, computer dictionary, medical dictionary and more.","Our online dictionary is the best source for definitions and origins of words, meanings of concepts, example sentences, synonyms and antonyms, grammar tips, and more.",YourDictionary: Definitions and Meanings From Over a Dozen Trusted Dictionary Sources
32,32,32,Education,https://si.edu,"Smithsonian - The world's largest museum and research complex, with 19 museums, 9 research centers and more than 140 affiliate museums around the world.","Official website of the Smithsonian, the world's largest museum and research complex, with 19 museums, 9 research centers, and affiliates around the world.",Smithsonian Institution | Home
33,33,33,Education,https://spanishdict.com,"SpanishDict | English to Spanish Translation, Dictionary and Translator | Diccionario y traductor inglés español - Free Spanish translation website. Effective, fast, and easy. Use our English to Spanish dictionary and Spanish translator to translate over 1,000,000 words and phrases from Spanish t",The world's most popular Spanish translation website. Over 1 million words and phrases. Free. Easy. Accurate.,"SpanishDict | English to Spanish Translation, Dictionary, Translator"
34,34,34,Education,https://mit.edu,MIT - Massachusetts Institute of Technology - MIT is devoted to the advancement of knowledge and education of students in areas that contribute to or prosper in an environment of science and technology.,"The mission of MIT is to advance knowledge and educate students in science, technology and other areas of scholarship that will best serve the nation and the world in the 21st century.",MIT - Massachusetts Institute of Technology
35,35,35,Education,https://britannica.com,"Britannica Online Encyclopedia - Explore the updated online encyclopedia from Encyclopaedia Britannica with hundreds of thousands of articles, biographies, videos, images, and web sites.","Explore the fact-checked online encyclopedia from Encyclopaedia Britannica with hundreds of thousands of objective articles, biographies, videos, and images from experts.",Encyclopedia Britannica | Britannica
36,36,36,Education,https://coolmath.com,"Cool Math - free online cool math lessons, cool math games & apps, fun math activities, pre-algebra, algebra, precalculus - Cool Math has free online cool math lessons, cool math games and fun math activities.  Really clear math lessons (pre-algebra, algebra, precalculus), cool math games, online g","Cool Math has free online cool math lessons, cool math games and fun math activities. Really clear math lessons (pre-algebra, algebra, precalculus), cool math games, online graphing calculators, geometry art, fractals, polyhedra, parents and teachers areas too.","Cool Math - free online cool math lessons, cool math games & apps, fun math activities, pre-algebra, algebra, precalculus"
37,37,37,Education,https://infoplease.com,"Infoplease: Encyclopedia, Almanac, Atlas, Biographies, Dictionary, Thesaurus. Free online reference, research & homework help. — Infoplease.com - Infoplease.com, a free, authoritative, and respected reference for Internet users, provides a comprehensive encyclopedia, almanac, atlas, dicti","Infoplease is a free, authoritative, and respected reference for Internet users that provides a comprehensive encyclopedia, almanac, atlas, dictionary, and thesaurus.","Infoplease: An Online Encyclopedia, Almanac, Atlas, Biographies, Dictionary, and Thesaurus"
38,38,38,Education,https://columbia.edu,Columbia University in the City of New York,,Columbia University in the City of New York
39,39,39,Education,https://usc.edu,"University of Southern California - The University of Southern California is one of the world's leading private research universities, located in the heart of Los Angeles. ","The University of Southern California is a leading private research university located in Los Angeles — a global center for arts, technology and international business. It is home to the College of Letters, Arts and Sciences and 21 exceptional academic schools and units. USC’s Health Sciences campus houses renowned specialized care and research in cancer, stem cell and regenerative medicine, orthopedics and sports medicine. The university is the largest private sector employer in the city of Los Angeles, responsible for $8 billion annually in economic activity in the region.",University of Southern California
40,40,40,Education,https://cornell.edu,"Cornell University - Cornell University contains seven undergraduate colleges plus the College of Veterinary Medicine, the Law School, the Samuel Curtis Johnson Graduate School of Management, the Weill Cornell Medical College in New York City and Doha, Qatar, and the 93 fields of study in the Gradu","Cornell University is a private research university that provides an exceptional education for undergraduates and graduate and professional students. Cornell's colleges and schools encompass more than 100 fields of study, with locations in Ithaca, New York, New York City and Doha, Qatar.",Cornell University
41,41,41,Education,https://purdue.edu,"Welcome to Purdue University - Purdue University is a major research institution known for discoveries in science, technology, engineering, math and beyond. Founded in 1869 in West Lafayette, Indiana, the University proudly serves its state as well as the nation and the world. More than 39,000 stud","Purdue University is a world-renowned, public research university that advances discoveries in science, technology, engineering and math. With its flagship campus in West Lafayette, Indiana, Purdue is a land-grant university with a system that has statewide campuses and online, adult-learning and polytechnic programs.",Purdue University - Indiana's Land Grant University
42,42,42,Education,https://searchquotes.com,"Quotes and Sayings - Search Quotes - Best collection of famous quotes and sayings on the web! Quotes from famous authors, movies and people. Amazing quotes to bring inspiration, personal growth, love and happiness to your everyday life.","Best collection of famous quotes and sayings on the web! Quotes from famous authors, movies and people. Amazing quotes to bring inspiration, personal growth, love and happiness to your everyday life.",Quotes and Sayings - SearchQuotes
43,43,43,Education,https://vt.edu,"Virginia Tech | Invent the Future - Virginia Polytechnic Institute and State University (Virginia Tech) is a public land-grant university serving the Commonwealth of Virginia, the nation, and the world community. The discovery and dissemination of new knowledge are central to its mission. Through i",,Home | Virginia Tech
44,44,44,Education,https://rosettastone.com,"Official Rosetta Stone® - Learn a Language Online - Learn Spanish - Learn Spanish, French & more with Rosetta Stone®, the #1 online language-learning software. Learn English, Italian, German & more with our language program.",Rosetta Stone is the best way to learn a foreign language. The award-winning language solution combines proven learning methods with the world's best speech recognition technology.,Official Rosetta Stone® - Language Learning - Learn a Language
45,45,45,Education,https://acronymfinder.com,"Abbreviations and acronyms dictionary: Find definitions for over 4,219,000 abbreviations, acronyms, and initialisms - Acronym Finder: The Acronym Finder is a searchable database of over 4 million acronyms, abbreviations and meanings. Covers: common acronyms, computers, science, technology, governme",Acronym Finder is the largest and most trusted database of over 4 million acronyms and abbreviations. What does an abbreviation stands for? The answer is here,Abbreviations and acronyms dictionary
46,46,46,Education,https://wisc.edu,University of Wisconsin–Madison,"The University of Wisconsin is a top-ranked research institution located in Madison, Wisconsin, providing exceptional education opportunities to undergraduates, graduate and professional students.",University of Wisconsin–Madison
47,47,47,Education,https://coursera.org,Coursera.org,"Learn online and earn valuable credentials from top universities like Yale, Michigan, Stanford, and leading companies like Google and IBM. Join Coursera for free and transform your career with degrees, certificates, Specializations, & MOOCs in data science, computer science, business, and dozens of other topics.",Coursera | Online Courses & Credentials From Top Educators. Join for Free
48,48,48,Education,https://nyu.edu,New York University,,NYU
49,49,49,Education,https://instructure.com,"Home | Canvas by Instructure - Canvas is the new, open-source learning management system that's revolutionizing the way we educate. Easy to learn, easy to use. Sign up for a free trial today!","Instructure's educational software includes Canvas LMS, used by schools and universities worldwide. Learn why Instructure is a great place to work and to invest in.",Instructure | Educational Software Development
50,50,50,Education,https://washington.edu,University of Washington,University of Washington,UW Homepage
51,51,51,Education,https://udacity.com,Advance Your Education With Free College Courses Online - Udacity - Discover free online classes from top instructors and industry experts. Take courses at your own pace. See what we have to offer.,"Learn online and advance your career with courses in programming, data science, artificial intelligence, digital marketing, and more. Gain in-demand technical skills. Join today!",Learn the Latest Tech Skills; Advance Your Career | Udacity
52,52,52,Education,https://metmuseum.org,The Metropolitan Museum of Art - Home  ,,
53,53,53,Education,https://education.com,"Education.com | An Education & Child Development Site for Parents | Parenting & Educational Resource - Education.com provides activities, worksheets, videos, expert advice and a school directory to give parents information and ideas to help kids reach their full potential and make learning fun.","Get a learning boost with thousands of worksheets, games, lesson plans, and more from our library of printable and digital resources for preschool, kindergarten, and elementary learners.",Education.com | #1 Educational Site for Pre-K to 8th Grade
54,54,54,Education,https://psu.edu,"Penn State - A public research university serving Pennsylvania and the global community - Penn State Homepage, Penn State","Penn State is a major, public, research-I university serving Pennsylvania and the global community. Learn more about our undergraduate, graduate, and doctoral degree programs.",The Pennsylvania State University | Penn State
55,55,55,Education,https://spellingcity.com,Spelling & Vocabulary Website: SpellingCity - Teaching spelling and vocabulary is easy with VocabularySpellingCity! Students can study and learn their word lists using vocabulary and spelling learning activities and games. Students can take final or practice spelling and vocabulary tests right ,Improve knowedge of vocabulary words with spelling practice from VocabularySpellingCity. Our engaging phonics games for kids help students become spelling masters.,Vocabulary Words - Spelling Practice - Phonics Games for Kids
56,56,56,Education,https://osu.edu,"Welcome - The Ohio State University - Ohio State is one of the largest universities in the nation. It's also home to a diverse group of the best and brightest people in the world: dedicated faculty, passionate students, and innovative researchers who make Ohio State one of the world's tru","Discover Ohio State, the highest ranked public university in Ohio, is home to the Wexner Medical Center and world-class graduate and undergraduate programs.",The Ohio State University
57,57,57,Education,https://ncsu.edu,"North Carolina State University | Tradition and Transformation - Learn more about North Carolina State University, located in Raleigh, N.C., and consistently recognized as one of the nation's top public universities.","Discover North Carolina State University, a leading public research university located in Raleigh, North Carolina.",NC State University
58,58,58,Education,https://fullsail.edu,"Full Sail University: Campus and Online Degrees - Full Sail University is an Award-Winning School for Entertainment Media that offers an exceptional education in both on-campus and online associates, bachelors, and masters degree programs.",error,error
59,59,59,Education,https://ucla.edu,"UCLA - UCLA (University of California, Los Angeles) is the largest UC campus in terms of enrollment, and one of the few public research universities located in a major city.","UCLA advances knowledge, addresses pressing societal needs and creates a university enriched by diverse perspectives were all individuals can flourish.",UCLA
