,Unnamed: 0,Unnamed: 0.1,Category,url,Description,description,title
367,367,54,Technology,https://squareup.com,"Accept credit cards with your iPhone, Android or iPad – Square - Accept credit card payments anywhere with your iPhone, Android or iPad. Download the free Square app to get started.",Square helps millions of sellers run their business-from secure credit card processing to point of sale solutions. Get paid faster with Square. Sign up today!,"Square | Solutions For Your Small, Medium & Large Business"
368,368,55,Technology,https://computerworld.com,"Computerworld - IT news, features, blogs, tech reviews, career advice - Computerworld covers a wide range of technology topics, including software, security, operating systems, mobile, storage, servers and data centers, and technology companies such as Microsoft, Google and Apple.","Computerworld covers a range of technology topics, with a focus on these core areas of IT: Windows, Mobile, Apple/enterprise, Office and productivity suites, collaboration, web browsers and blockchain, as well as relevant information about companies such as Microsoft, Apple and Google.","IT news, careers, business technology, reviews | Computerworld"
369,369,56,Technology,https://geek.com,Geek.com,error,error
370,370,57,Technology,https://otterbox.com,OtterBox Cases | The # 1 selling case for smartphones | OtterBox.com - See why OtterBox is the #1 selling case for smartphones. Get the kind of protection that inspires confidence with OtterBox tablet and smartphone cases.,OtterBox designs protective and stylish phone cases as well as the best premium coolers and accessories. Shop now and see how OtterBox enables your everyday.,"OtterBox | Cases, Accessories & Outdoor Gear"
371,371,58,Technology,https://techmeme.com,Techmeme - The essential tech news of the moment. Technology's news site of record. Not for dummies.,The essential tech news of the moment. Technology's news site of record. Not for dummies.,Techmeme
372,372,59,Technology,https://hackaday.com,Hack a Day — Fresh hacks every day - Fresh hacks every day,Fresh hacks every day,Hackaday | Fresh Hacks Every Day
373,373,60,Technology,https://geeks.com,"Computer parts, Laptop computers, Desktop computers, Computer Hardware - Geeks.com - The Best Deals Online; Save on Computer Parts, Computer Hardware, Laptops, Tablets, Desktop Computers and More - Fast Shipping, Excellent Customer Service..",,Home page - Geeks
374,374,61,Technology,https://webpronews.com,"WebProNews - Breaking News in Tech, Search, Social, & Business","Breaking business news covering marketing, I.T., ecommerce & emerging trends like electric vehicles, solar energy, financial tech & space.","WebProNews - Digital Marketing, Technology, and Business News"
375,375,62,Technology,https://retrevo.com,"Discover, Evaluate, and Shop with the Gadget Experts at Retrevo",error,error
376,376,63,Technology,https://intel.com,"Intel Canada - English - Intel plant und baut die wesentlichen Technologien, die als Grundlage für die weltweit EDV-Geräte dienen","Intel's innovation in cloud computing, data center, Internet of Things, and PC solutions is powering the smart and connected digital world we live in.","Intel | Data Center Solutions, IoT, and PC Innovation"
377,377,64,Technology,https://phonearena.com,"Phone Arena - Phone News, Reviews and Specs - Phone Arena is the premium website for new phone information such as full specifications, in-depth reviews, latest news, carrier available and upcoming phones. It features dedicated phone discussions, advanced phone filter, visual size comparison and 36","PhoneArena is the premium website for new phone information such as full specifications, in-depth reviews, latest news, carrier available and upcoming phones. It features advanced phone filter, visual size comparison and 360 degree views of all hot phones.","PhoneArena - Phone News, Reviews and Specs"
378,378,65,Technology,https://logitech.com,Logitech - Get Immersed in the Digital World!,Beli online sekarang! Temukan pilihan jajaran Produk Logitech terbesar. Toko Online Resmi dengan penawaran eksklusif. Jaminan uang kembali. Berlangganan buletin kami.,"Logitech: Wireless Mouse, Keyboard, Headset, &amp; Konferensi Video"
379,379,66,Technology,https://popularmechanics.com,"Popular Mechanics - Automotive Care, Home Improvement, Tools, DIY Tips - Popular Mechanics is a service magazine covering a variety of information on home improvement, automotive needs, electronics, computers, telecommunications, outdoors, fitness and science and technology. Popular Mechanics also ","Popular Mechanics inspires, instructs and influences readers to help them master the modern world, whether it's practical DIY home-improvement tips, gadgets and digital technology, information on the newest cars or the latest breakthroughs in science.","Popular Mechanics - Product Reviews, How-To, Space, Military, Math, Science, and New Technology"
380,380,67,Technology,https://mobile9.com,"Free Nokia Themes, Free Ringtones, Free Apps - mobile9 - mobile9 is an app store and more. Truly open, truly social. Millions of members are sharing the fun and billions of free downloads served.",,"Are you human, bot or alien? | mobile9"
381,381,68,Technology,https://androidpolice.com,"Android Police - Android News, Apps, Games, Phones, Tablets",error,error
382,382,69,Technology,https://itworld.com,"IT news, technology analysis and how-to resources | ITworld - IT news and breaking technology stories covering IT security, cloud computing, virtualization, and more.","Find the peer insights and expert advice IT leaders need to create business value with technology, drive innovation and develop their careers.",CIO.com - The voice of IT leadership
383,383,70,Technology,https://ghacks.net,"GHacks Technology News | Latest Tech News, Software And Tutorials Page 1",,Homepage | gHacks Technology News
384,384,71,Technology,https://extremetech.com,Latest Technology News | Tech Blog | ExtremeTech - Latest Technology News | Tech Blog | ExtremeTech,"ExtremeTech - ExtremeTech is the Web's top destination for news and analysis of emerging science and technology trends, and important software, hardware, and gadgets.","ExtremeTech - ExtremeTech is the Web's top destination for news and analysis of emerging science and technology trends, and important software, hardware, and gadgets."
385,385,72,Technology,https://imore.com,"IMore.com | The #1 Site for iPhone, iPad, iPod touch and Apple TV owners","The ultimate source for iPhone, iPad, Mac, and Apple Watch content. Never miss out on news, deals, reviews, or how-tos! Learn about the products your love, and never worry about buyer's remorse with our buying guides. All this and more on iMore. - Learn More. Be More.","iMore - Apple News, Reviews, Deals, & Help | Learn more. Be more."
386,386,73,Technology,https://ilounge.com,"All things iPod, iPhone, iPad and Beyond | iLounge - All Things iPod, iPhone, iPad and Beyond.","iLounge is an independent provider of information about Apple Inc.'s iPod, iPhone and iPad digital media players, accessories, and related software.","iLounge - All things iPod, iPhone, iPad and Beyond"
387,387,74,Technology,https://notebookreview.com,"Laptop Reviews - Notebook Reviews and Computer News - NotebookReview.com offers the latest notebook and laptop reviews, as well as price comparisons, support forums and news.",error,error
388,388,75,Technology,https://phandroid.com,"Android Phone - #1 Site for Android Phone Reviews, News, Apps, Games and Rumors. Also covers Android Tablets and other Android devices!","The world's first Android News Source, Phandroid.com covers Android news, reviews, and tips to help you get the most out of your smartphone or tablet.",Phandroid
389,389,76,Technology,https://cio.com,"CIO.com - CIO.com delivers the latest tech news, analysis, how-to, blogs, and video for IT professionals. Covers apps, careers, cloud computing, data center, mobile, outsourcing, security, social media, hardware and software.","Find the peer insights and expert advice IT leaders need to create business value with technology, drive innovation and develop their careers.",CIO.com - The voice of IT leadership
390,390,77,Technology,https://asus.com,"ASUS   - ASUS is a leading company driven by innovation and commitment to quality for products that include notebooks, netbooks, motherboards, graphics cards, displays, desktop PCs, servers, wireless solutions, mobile phones and networking devices. ASUS ranks among BusinessWeek’s InfoTech 100 for",error,error
391,391,78,Technology,https://osxdaily.com,"News, Tips, and Reviews for Mac, iPhone, and iPad - OS X Daily  -   News, tips, software, reviews, and more for Mac OS X, iPhone, iPad   ","News, tips, software, reviews, and more for Mac OS X, iPhone, iPad","OS X Daily - News and Tips for Mac, iPhone, iPad, and Everything Apple"
392,392,79,Technology,https://labnol.org,"Digital Inspiration - Technology Blog - Digital Inspiration is a popular how-to website that covers computer software, mobile apps, video tutorials and useful websites","Tech, a la carte","Digital Inspiration - Tech Tips, Tutorials & How-to Guides"
393,393,80,Technology,https://informationweek.com,"InformationWeek | Business Technology News, Reviews and Blogs - InformationWeek is the leading news and information source for information technology professionals and business managers with technology management and purchasing authority. InformationWeek.com provides breaking news online and in new","InformationWeek.com: News analysis and commentary on information technology trends, including cloud computing, DevOps, data analytics, IT leadership, cybersecurity, and IT infrastructure.","InformationWeek, serving the information needs of the Business Technology Community"
394,394,81,Technology,https://cyanogenmod.com,"CyanogenMod | Android Community Rom based on Jelly Bean - CyanogenMod (pronounced sigh-AN-oh-jen-mod), is a customized, aftermarket community based firmware distribution for several Android devices.",error,error
395,395,82,Technology,https://komando.com,Komando.com,error,error
396,396,83,Technology,https://crucial.com,"RAM Memory Upgrade: Dell, Mac, Apple, HP, Compaq. USB drives, SSD at Crucial.com   - Memory upgrades from Crucial.com","Find compatible DRAM memory and SSD upgrades for your PC or Laptop with our Crucial Advisor tool or Crucial System Scanner, with FREE US delivery!","Crucial US | DRAM, Solid State Drive (SSD) & Memory Upgrades"
397,397,84,Technology,https://techspot.com,"TechSpot - Technology News, Reviews and Analysis - TechSpot is a leading PC technology publication. Read daily by tech influencers, computer enthusiasts and IT decision makers, TechSpot brings the latest tech news and analysis on personal technology.","Technology news, reviews, and analysis for power users, enthusiasts, IT professionals and PC gamers.",TechSpot
398,398,85,Technology,https://crackberry.com,CrackBerry.com – The #1 Site for BlackBerry Users & Abusers,"The #1 community and resource for all things BlackBerry: news, reviews, help & how to, apps, games, accessories & more!",CrackBerry | The #1 Site for BlackBerry Users (and Abusers!)
399,399,86,Technology,https://sevenforums.com,"Windows 7 Forums  - Windows 7 Forums the biggest Windows 7 help and support forum, friendly help and many Windows 7 tutorials that will help you get the most out of Microsofts new Windows 7 Operating System.",error,error
400,400,87,Technology,https://htc.com,"HTC - HTC is the creator of many award-winning mobile devices and industry firsts. HTC’s portfolio includes smartphones and tablets powered by HTC Sense™, a multilayered graphical user interface that vastly improves user experience. Explore all HTC smartphones, get support, and find out where t",,HTC SUPPORT
401,401,88,Technology,https://techdirt.com,Techdirt.,error,error
402,402,89,Technology,https://infoworld.com,"Business technology, IT news, product reviews and enterprise IT strategies - InfoWorld - InfoWorld is the leading technology resource for IT managers and decision makers to identify new products and strategies to modernize IT.","Business technology, IT news, product reviews and enterprise IT strategies.",InfoWorld - Technology insight for the enterprise
403,403,90,Technology,https://androidandme.com,"Android and Me - Android and Me covers all the latest Android news, phone launches, app reviews, software updates, Android hacks, and phone accessories.",error,error
404,404,91,Technology,https://iobit.com,"Speed Up Slow Computer, Keep PC and Internet Secure, Freeware Download - IObit - Builds high-performing software products to free speed up computer, fix & clean registry and malware, optmize PC games, tune up Windows 7, Vista, XP, etc.",error,error
405,405,92,Technology,https://macsales.com,"Performance Upgrades; FireWire USB SATA Storage; Memory, more at OWC","Upgrade the RAM and storage of nearly any Apple computer at MacSales.com. We also provide refurbished Macs, external storage, docks, accessories, and more!","Apple Mac Upgrades - RAM, SSD Flash, External Drives and More"
406,406,93,Technology,https://slashgear.com,SlashGear - Feeding Your Gadget and Tech Obsessions,"SlashGear covers technology, science, automotive, gaming, and entertainment, bringing thought-provoking and independent insight since 2005",SlashGear
407,407,94,Technology,https://bgr.com,"BGR | The Three Biggest Letters in Tech - BGR: The leading mobile and technology news source for breaking news, reviews, insights and opinions","BGR features the latest tech news and product reviews, top-rated buying guides, entertainment, science, and lifestyle coverage.","BGR – Tech News, Reviews, & Top-Rated Buying Guides"
408,408,95,Technology,https://appbrain.com,"Top Android Apps and Games in the Android Market | AppBrain.com - Search the Android market and discover the best Android apps from AppBrain, the leading Android app directory.","Grow your app business with AppBrain: Monetize, advertise and analyze Android apps","Monetize, advertise and analyze Android apps | AppBrain.com"
409,409,96,Technology,https://pocket-lint.com,"Pocket-lint - Gadget Reviews, Product News, Electronic Gadgets","Welcome to Pocket-lint, for the latest electronic product reviews, including news on gadgets, digital cameras, home cinema, audio, cars and mobile phone.","Pocket-lint - Gadget Reviews, Product News, Electronic Gadgets"
410,410,97,Technology,https://addictivetips.com,"AddictiveTips - Tech tips to make you smarter - We cover the best desktop, web and mobile apps, guides and how-to tips for Windows, Mac, Linux, Android, iOS, and Windows Phone.",error,error
411,411,98,Technology,https://geforce.com,"World's Fastest Graphics Cards, GPUs, and Video Cards | GeForce - Check out the latest GeForce news and reviews, including GPU benchmarks, overclocking guides, GeForce optimized PC games, and cutting edge GeForce and 3D technology.","The world's most advanced graphics cards, gaming solutions, and gaming technology - from NVIDIA GeForce.","GeForce.com Official Site: RTX Graphics Cards, VR, Gaming, Laptops"
412,412,99,Technology,https://eweek.com,"Technology News, Tech Product Reviews, Research and Enterprise Analysis - News & Reviews - eWeek.com - eWEEK is the essential technology information source for builders of enterprise infrastructure. eWEEK enables readers to successfully evaluate, deploy and leverage new technology solutions for",error,error
413,413,100,Technology,https://techpowerup.com,TechPowerUp - The latest in hardware and gaming,"Leading tech publication, with fast news, thorough reviews, and a strong community.",TechPowerUp
414,414,101,Technology,https://networkworld.com,"Network World - Network news, trend analysis, product testing and the industry’s most important blogs,  all collected at the most popular network watering hole on the Internet","Network news, trend analysis, product testing and the industry’s most important blogs,  all collected at the most popular network watering hole on the Internet | Network World",Welcome to Network World.com
415,415,102,Technology,https://maximumpc.com,"Technology News, Computer and Notebook Reviews, Computer News, Computer Mods, PC News | Maximum PC - MaximumPC brings you the latest technology news, computer mods, computer news and the latest computer and notebook reviews. Read the latest PC news",error,error
416,416,103,Technology,https://wirefly.com,"Free Cell Phones with New Cell Phone Plans - Shop Deals from Wireless Carriers - Wirefly.com - Wirefly is the #1 site for cell phones and wireless phone plans. We offer free cell phones, cheap cell phones and discount prepaid cell phones from Verizon Wireless, T-Mobile, Sprint, Nextel, Cingular, AT","Compare cell phone plans, deals, smartphones, Internet providers, TV service, business and residential phone service, and more to save money at Wirefly.","Wirefly | Cell Phone Deals, Compare Cell Phones & Plans"
417,417,104,Technology,https://howardforums.com,HowardForums: Your Mobile Phone Community & Resource - HowardForums Home - vBulletin 4.0 Publishing Suite with CMS,Discuss your favorite mobile phone carriers and cell phone manufacturers,HowardForums: Your Mobile Phone Community & Resource
418,418,105,Technology,https://killerstartups.com,KillerStartups - Where Internet Entrepreneurs Are The Stars - Where Internet Entrepreneurs Are The Stars,Where Internet Entrepreneurs Are The Stars,KillerStartups.com – Where Internet Entrepreneurs Are The Stars
419,419,106,Technology,https://radioshack.com,"RadioShack - mobile phones, MP3 players, laptops, and more - The Shack helps you get it right with the biggest brands and latest products","The Shack Is Back! Shop Radios, Headphones, TV Antennas, Cables & Adapters, DIY Tools & Parts, Electronics Maker Kits, and much more brand new arrivals daily! Don't forget to visit any of our 450+ RadioShack locations across America!",RadioShack.com Official Site - America's Technology Store
420,420,107,Technology,https://windowsphone.com,Windows Phone (United States),error,error
421,421,108,Technology,https://nokia.com,"Handy, Smartphone, Mobiltelefon - Nokia - Deutschland - Nokia Polska - Oficjalna strona. Nokia w internecie. Na stronach internetowych firmy Nokia znajdziesz informacje na temat telefonów i akcesoriów Nokia.","As a technology leader across mobile, fixed and cloud networks, our solutions enable a more productive, sustainable and inclusive world.",Nokia Corporation
422,422,109,Technology,https://digikey.com,"DigiKey Electronics - Electronic Components Distributor - Electronic Components Distributor DigiKey carries RFID, ICs, Semiconductors, Connectors & More. Datasheets, Same Day Ship, Large In Stock Quantities.","Digi-Key offers 13.4M +  products from 2,300+ manufacturers. Large in-stock quantities able to ship same day. Paypal accepted, order online today!",DigiKey Electronics - Electronic Components Distributor
423,423,110,Technology,https://idownloadblog.com,"IDownloadBlog • iPhone • iPad • iOS Blog - iDownload Blog is focused on delivering iPhone, iPad, iPod, Apple TV, and iOS news, jailbreak information, reviews as well as guides and tutorials about everything iOS.","The best Apple blog providing news, reviews, tutorials, and jailbreak info, about everything iPhone, iPad, Apple Watch, Apple TV, Mac and iOS.",iDownloadBlog – Apple Blog: iPhone • Watch • iOS • Mac
424,424,111,Technology,https://betanews.com,Technology News and Analysis - BetaNews - BetaNews is a leading source of technology news and analysis,BetaNews is a leading source of technology news and analysis,Technology News and Analysis - BetaNews
425,425,112,Technology,https://bleepingcomputer.com,"Bleeping Computer - Technical Support and Computer Help - A free web based community and technical support forum for answering Technical Support, Computer Help, and Security questions asked by the Novice Computer User",error,error
426,426,113,Technology,https://maclife.com,"Mac|Life | iPhone, iPad, Mac - Maclife.com is the ultimate destination for all things Mac. Get up-to-date News, Reviews and Information on the latest Apple Products including iPod, iPhone, Macbook. Check out of Software and Downloads section too!",error,error
427,427,114,Technology,https://androidzoom.com,Download thousands of Android apps from the Android Market. - AppsZoom.com - Download all available Android apps in the Android Market for your Android device.,error,error
428,428,115,Technology,https://brighthub.com,"Find Science & Technology Articles, Education Lesson Plans, Tech Tips, Computer Hardware & Software Reviews, News and More at Bright Hub - Discover a wealth of Science and Technology articles at Bright Hub, where you can also find K-12 Education lesson plans written and vetted by educators.",error,error
429,429,116,Technology,https://afterdawn.com,"AfterDawn - Software downloads, reviews, tech news and guides - Latest technology news, how-to guides, product reviews and software downloads.","Latest technology news, how-to guides, product reviews and software downloads.","AfterDawn - Software downloads, reviews, tech news and guides"
430,430,117,Technology,https://lockergnome.com,"LockerGnome - Solve Your Tech Problems with How to; Keeping You Informed & Entertained Since 1996! - LockerGnome: Sharing Stories about Technology, Science, Geek, and Internet Culture Since 1996 - information and insight you can't find anywhere else!","3D Printing! Sometimes silly. Sometimes serious. Always interactive. I'm a variety streamer geek / nerd just chatting every night at 6PM PT. I love Star Wars, LEGO, pop culture / entertainment, retro fun, toys & collectables, and helping fellow creators. My community: https://twitch.tv/MakerDeck!",ChrisPirillo - Twitch
431,431,118,Technology,https://pcadvisor.co.uk,"Technology reviews, advice, videos, news and forums - PC Advisor - Expert PC help and advice including news, hardware reviews, forums, buying advice and software downloads from PC Advisor","Expert advice you can trust for all your tech needs, covering phones, tablets, laptops, wearables, gaming, entertainment, security, accessories &amp; more","Tech Advisor: Tech Reviews, News, Tutorials & Buying Advice"
432,432,119,Technology,https://ubergizmo.com,Ubergizmo,,Ubergizmo
433,433,120,Technology,https://amd.com,"Global Provider of Innovative Graphics, Processors and Media Solutions | AMD   -   	Advanced Micro Devices (NYSE: AMD) is an innovative technology company dedicated to collaborating with customers and partners to ignite the next generation of computing and graphics solutions at work, home, and play",error,error
434,434,121,Technology,https://pinger.com,"Pinger makes texting and talking free. - Pinger makes texting and talking free. Our market-leading communications products have been downloaded by millions of iPhone, iPod touch, iPad and Android users around the world.",error,error
435,435,122,Technology,https://redmondpie.com,"Redmond Pie - Covering Microsoft, Google, Apple and the web!","Covering Microsoft, Apple, Google, Tesla and the web!",Redmond Pie
436,436,123,Technology,https://overclock.net,"Overclock.net - An Overclocking Community - An overclocking forum devoted to maximizing the performance of graphics cards, CPUs, motherboards, RAM and everything else found inside your computer case.",error,error
437,437,124,Technology,https://socialtimes.com,SocialTimes - Your Social Media Source - Your Social Media Source,error,error
438,438,125,Technology,https://androidcommunity.com,Android Community - Tracking the Android Platform,"Android Community is obsessed with all things Android, covering phones, tablets, apps and hacks to get the best out of Google’s OS.","Android Community - Android News, Reviews, and Apps"
439,439,126,Technology,https://toshiba.com,"Laptops, LCD Televisions, Projectors, Medical Imaging & More - Toshiba America Inc - Toshiba U.S. products, services and support information.",error,error
440,440,127,Technology,https://droidforums.net,"Droid Forum - Dedicated Verizon Android Forum - Droid, Droid2, Droid3, Droid4, Droid X, Droid X2, Bionic, RAZR  - Forums and News covering all Droid Phones. The Verizon Droid community & information resource!","DroidForums is the #1 Android Forum & Android News site providing Android Help for Samsung, Motorola, HTC, LG and Sony  Android Phones.",DroidForums.net | Android Forums & News
441,441,128,Technology,https://dvice.com,DVICE,error,error
442,442,129,Technology,https://cpubenchmark.net,"PassMark Software - CPU Benchmark Charts - PassMark Software - CPU Benchmarks - Over 600,000  CPUs and 1,000 models benchmarked and compared in graph form, updated daily!","PassMark Software - CPU Benchmarks - Over 1 million CPUs and 1,000 models benchmarked and compared in graph form, updated daily!",PassMark Software - CPU Benchmark Charts
443,443,130,Technology,https://adweek.com,"Adweek – Breaking News in Advertising, Media and Technology - Adweek is a magazine and website that covers media news, including print, technology, advertising, branding and television.","Breaking News in Advertising, Media and Technology",Adweek
444,444,131,Technology,https://iclarified.com,IClarified - Apple News and Tutorials - News and tutorials to help you understand your Mac and other Apple Products,,iClarified - Apple News and Tutorials
445,445,132,Technology,https://samsungapps.com,"Samsung Apps - Samsung Apps is a marketplace designed to provide a variety of mobile applications especially developed and carefully selected for Samsung Mobile Phones. It's a new Samsung mobile world, and we provide you a brand-new mobile experience.",,
446,446,133,Technology,https://mouser.com,"Mouser Electronics - Electronic Components Distributor   - Electronic Components Distributor, order on-line, same-day shipping, no minimum order. New electronic parts added daily.",error,error
